control_id,iteration,recommendation
150,9,"The most frequent recorded variants 'N R C' (182 incidents), 'N N R C' (81 incidents), and 'N N N R C' (49 incidents) are now considered compliant; their bypass of 'activation' (A) and repeated 'detection' (N) are explained by automatic merge rules, not human process errors. However, the second most frequent variant, 'A R C' (135 incidents), still indicates a compliance concern by bypassing the initial 'detection' (N) state, which is not covered by the provided exemptions. This 'missing N' pattern suggests incidents are activated without formal detection, requiring investigation to understand the root cause for 135 occurrences and ensure all incidents properly begin with 'detection'. Additionally, repetitive 'awaiting' (W) deviations are dismissed as non-process harming."
150,10,"The most frequent recorded variant is 'N R C' (182 occurrences), indicating incidents transitioning directly from 'detection' to 'resolution' and 'closure', bypassing 'activation' and 'awaiting'. This variant is not considered a process error due to automated merge rules. The second most frequent is 'A R C' (135 occurrences), where incidents start at 'activation' without a recorded 'detection', suggesting alternative initiation methods that warrant further investigation.

Despite the clarifications, the 'activation' (A) state shows critical compliance issues: its average duration of 8 days, 18 hours, 55 minutes far exceeds the non-acceptable threshold of 5 days (7200 minutes). Furthermore, 'activation' recorded 1990 repetitions (acceptable `<=500`) and 115 mismatches (acceptable `<=50`), indicating significant process inconsistencies. Similarly, the 'awaiting' (W) state exhibits an average duration of 16 days, 8 hours, 10 minutes, severely exceeding its non-acceptable threshold of 10 days (14400 minutes), pointing to prolonged periods of inactivity even if operator-controlled.

**Recommendation:**
Investigate the root causes for the excessive average duration, high repetitions, and mismatches within the 'activation' state, as these are critical process deviations. Additionally, explore strategies to reduce the prolonged average time spent in the 'awaiting' state and understand the origin of 'A R C' variants to ensure comprehensive incident tracking."
151,1,"Overall compliance, as measured by the average non-compliance cost per activity, is high for all activities (Detection: 0.02, Activation: 0.02, Awaiting: 0.0, Resolution: 0.0, Closure: 0.0), consistently falling within the acceptable threshold of `<= 0.05`. This favorable assessment considers updated interpretations, effectively excusing high repetition counts in detection (1777) and awaiting (1653) and implicitly addressing missing activation (544) deviations due to N*RC paths. Despite this, critical operational bottlenecks persist as average times in Detection (4d 6h 35min), Activation (8d 18h 55min), Awaiting (16d 8h 10min), and Resolution (5d 22h 11min) significantly exceed their respective non-acceptable thresholds. Therefore, while the cost metric shows compliance, immediate remediation efforts should prioritize drastically reducing these activity durations and further investigating remaining high deviations in Activation (1990 repetition, 115 mismatch) and Resolution (119 repetition, 45 mismatch)."
151,2,"Based on the 'cost' compliance metric and the provided tunings, all process activities (detection, activation, awaiting, resolution, closure) are compliant. Their average non-compliance costs are 0.02 for 'detection' and 'activation', and 0.0 for 'awaiting', 'resolution', and 'closure', all falling within the 'low' severity range ($>= 0.0$ AND $< 0.1$) and below the acceptable threshold of `<= 0.05` per activity. The high counts of repetitive 'detection' and 'awaiting' deviations, as well as 'missing' states due to N*RC variants, do not impact compliance as per the updated environmental parameters and tunings, hence no remediation is required."
151,3,"Based on the `cost` compliance metric, all activities (Detection: 0.02, Activation: 0.02, Awaiting: 0.0, Resolution: 0.0, Closure: 0.0) show average non-compliance costs well within the 'low' severity range and below the acceptable threshold of `<= 0.05` for each activity, indicating high process compliance after considering specified deviation exceptions. However, the average time spent in Detection (4d, 6h, 35min), Activation (8d, 18h, 55min), Awaiting (16d, 8h, 10min), and Resolution (5d, 22h, 11min) activities significantly exceeds their respective non-acceptable time thresholds. Remediation is required to investigate and address the root causes of these prolonged durations to improve overall incident handling efficiency and meet time-based performance targets."
151,4,"The re-evaluation using the non-compliance cost metric and adjusted interpretations shows that 'Activation' remains non-compliant, exhibiting a Moderate cost of 0.1555, coupled with critical deviations in repetition (1990) and mismatch (115), and an excessive average time of 8d 18h 55min. While 'Detection' (cost 0.0435), 'Awaiting' (cost 0.0005), and 'Resolution' (cost 0.0214) are now compliant by cost due to updated interpretations, they still present critical issues in other aspects. 'Detection' has excessive missing events (319) and an average time of 4d 6h 35min, 'Awaiting' shows an excessive average time of 16d 8h 10min, and 'Resolution' reports critical repetition (119) and mismatch (45) deviations along with an average time of 5d 22h 11min.\n\n**Required Remediation:**\nImmediate action is needed for 'Activation' by thoroughly investigating the root causes of persistent repetition and mismatch deviations. For 'Detection', implement controls to reduce missing events and streamline the activity to shorten the 4-day average time. For 'Awaiting' and 'Resolution', optimize processes to drastically reduce their excessive average times (16d and 5d respectively), and for 'Resolution', specifically address the critical repetition and mismatch deviations."
151,5,"The incident management process shows excellent compliance regarding the non-compliance cost metric, with all activity averages between 0.00 and 0.02, which is well within the "low" severity range and below the acceptable threshold of <=0.05. Repetitive detection deviations (1777) and awaiting activities (1653) are within their respective tuned acceptable thresholds (<=5000 and <=2000), and due to automated merging and external factors, are not considered process compliance impediments for responders. However, process efficiency is critically impacted by excessive average durations in Detection (4d 6h 35min), Activation (8d 18h 55min), Awaiting (16d 8h 10min), and Resolution (5d 22h 11min), all dramatically exceeding non-acceptable time limits. Remediation must focus on thoroughly investigating and reducing these prolonged activity durations to improve overall incident handling."
151,6,"The average non-compliance cost for all incident activities (Detection: 0.02, Activation: 0.02, Awaiting: 0.0, Resolution: 0.0, Closure: 0.0) falls within the 'low' severity range (>= 0.0 AND < 0.1) and is below the acceptable threshold of <= 0.05. This indicates overall compliance based on the cost metric.\n\nHowever, the provided rule changes for specific deviation types imply they should not contribute to the compliance cost from a Responder's perspective, suggesting the initial reported costs might not fully reflect the intended assessment. Specifically, repetitive detection deviations (1777 in 'N') and repetitive awaiting activities (1653 in 'W') are deemed not process errors or harming deviations. Assuming these exclusions are correctly applied to the provided average costs, no activities are currently impeding compliance.\n\n**Recommendation:** Based on the provided average non-compliance costs per activity, all activities are compliant. The Responder should document this current high level of compliance in the specified areas, particularly acknowledging that previously flagged repetition issues in 'Detection' and 'Awaiting' are now excluded due to policy changes. No immediate remediation is required for compliance based on the current metrics and adjusted rules."
151,7,"While all process activities currently demonstrate 'low' average non-compliance cost (ranging from 0.0 to 0.02), falling below the acceptable threshold of 0.05, several specific activities exhibit deviation non-compliance. 'Detection' shows high missing deviations (319 vs. an acceptable <=20). 'Activation' remains a critical area with 1990 repetition deviations (threshold <=500) and 115 mismatch deviations (threshold <=50); its 544 missing deviations (threshold <=200) require further data to differentiate between actual non-compliance and acceptable N*RC variant cases. 'Resolution' is also non-compliant with 119 repetition (threshold <=50) and 45 mismatch (threshold <=20) deviations.

**Recommendation:** Focus remediation efforts on addressing the high volume of missing 'Detection' activities. For 'Activation', implement urgent process enforcement and training to reduce repetition and mismatch deviations, and gather further data to clarify the actual non-compliance of missing activities, considering the N*RC variant. Similarly, improve compliance for 'Resolution' activities by addressing the identified repetition and mismatch deviations."
151,8,"Based on the 'cost' compliance metric and adjusted deviation interpretations, all activities (Detection, Activation, Awaiting, Resolution, Closure) exhibit low severity, with average costs ranging from 0.00 to 0.02, meeting the acceptable compliance threshold of `<= 0.05`. However, a critical non-compliance issue persists in average activity durations. Detection (6155 min), Activation (12655 min), Awaiting (23530 min), and Resolution (8531 min) significantly exceed their respective acceptable time thresholds (e.g., Detection <=1440 min). As a Responder, immediate remediation is required to investigate the root causes of these prolonged durations and implement process optimizations to improve the efficiency of these critical incident management phases."
151,9,"The incident management compliance for the 'cost' metric shows 'Activation' as the primary impeding activity. After applying the non-compliance cost model and updated interpretations, 'Activation' has an average non-compliance cost of approximately 0.1591, which falls into the 'moderate' severity level and exceeds the acceptable threshold of <= 0.05. Repetitive deviations in 'Detection' (1777) and 'Awaiting' (1653) are now deemed acceptable due to updated thresholds (<=5000 and <=2000 respectively).\n\nWhile the N*RC variant should discount certain 'missing Activation' deviations, explicit data is insufficient to precisely quantify this impact; however, 'Activation' remains non-compliant even if a significant portion of these were excluded due to its high 'repetition' and 'mismatch' costs. All other activities ('Detection', 'Awaiting', 'Resolution', 'Closure') are within acceptable cost thresholds, with average costs of 0.0398, 0.0005, 0.0196, and 0.0008 respectively, placing them in the 'low' severity category.\n\n**Required Remediation:**\nFocus remediation efforts on the 'Activation' activity to reduce its overall non-compliance cost. Investigate the root causes of the high 'repetition' (1990 instances) and 'mismatch' (115 instances) deviations in 'Activation' to implement corrective actions. To improve future assessments, gather specific data on incidents processed via the N*RC variant to accurately exclude non-compliant 'missing Activation' occurrences."
151,10,"Based on the `cost` compliance metric and updated environmental interpretations, all activities (Detection, Activation, Awaiting, Resolution, Closure) show average non-compliance costs of 0.02 or 0.0, which fall within the 'low' severity band (`>= 0.0 AND < 0.1`) and meet the `acceptableCompliance` threshold of `<= 0.05`. This indicates overall compliance according to the defined cost metric, incorporating the recently tuned thresholds for repetitive detection deviations (N: 1777 vs `<=5000`) and repetitive awaiting activities (W: 1653 vs `<=2000`), and considering N*RC variants as non-process errors.\n\nHowever, from a Responder's perspective focused on detailed process activities, significant underlying operational inefficiencies persist:\n*   **Activation (A):** Despite low average cost, missing (544 vs <=200), repetition (1990 vs <=500), and mismatch (115 vs <=50) deviations remain excessively high against their thresholds, and the average time (8d 18h 55min) is above the non-acceptable threshold (`>= 7200min`).\n*   **Resolution (R):** Repetition (119 vs <=50) and mismatch (45 vs <=20) deviations are significantly high, with an average time (5d 22h 11min) also exceeding the non-acceptable threshold (`>= 4320min`).\n*   **Detection (N):** Missing deviations (319 vs <=20) are notably high, and the average time (4d 6h 35min) is above the acceptable threshold (`<= 1440min`).\n*   **Awaiting (W):** The average time (16d 8h 10min) is critically long, exceeding the non-acceptable threshold (`>= 14400min`), despite low deviation counts after tuning.\n\n**Recommendation:** While the overall average non-compliance cost is low, significant operational inefficiencies remain. Implement targeted remediation for Activation to reduce all deviation types and improve processing times. For Resolution, focus on reducing repetition and mismatch deviations and accelerating incident handling. Improve the initial detection process to reduce missing activities, and investigate the root causes for the critically long average time in Awaiting activities to enhance overall incident flow efficiency."
152,1,"The average durations for Detection (4d 6h 35min / 6155 min), Activation (8d 18h 55min / 12655 min), Awaiting (16d 8h 10min / 23530 min), and Resolution (5d 22h 11min / 8531 min) critically exceed their respective non-acceptable time thresholds (2880 min, 7200 min, 14400 min, 4320 min), indicating severe process efficiency impediments from a Responder's perspective. While average compliance cost values are low, the excessive durations necessitate an immediate investigation into their root causes.\n\n**Recommendation:**\nPrioritize an immediate investigation into the root causes of the prolonged average durations for Detection, Activation, Awaiting, and Resolution. For Activation and Resolution, focus on high repetitions (1990, 119) and mismatches (115, 45) that exceed acceptable deviation thresholds, indicating internal process inefficiencies. For Awaiting, despite repetitions (1653) being outside security operator control, the critical 16-day duration demands strategies to mitigate external dependencies' impact on incident timelines. Also investigate the 319 missing Detection events, which remain a significant deviation."
152,2,"The assessment of average activity durations reveals significant efficiency impediments in Detection, Activation, Awaiting, and Resolution. All four states far exceed their non-acceptable time thresholds: Detection (6155 min vs. >=2880 min), Activation (12655 min vs. >=7200 min), Resolution (8531 min vs. >=4320 min), and most severely, Awaiting (23530 min vs. >=14400 min). While certain repetitive deviations in Detection and Awaiting, or the skipping of Activation/Awaiting in N*RC variants, are contextually deemed non-process harming for compliance, the extensive average durations in these active states still represent critical bottlenecks. Remediation must prioritize optimizing initial incident triage and tooling for Detection, streamlining activation processes, enhancing external coordination and follow-up for Awaiting states, and improving resolution efficiency."
152,3,"The assessment of average activity durations reveals significant efficiency impediments, with 'awaiting' (23530 minutes), 'activation' (12655 minutes), 'resolution' (8531 minutes), and 'detection' (6155 minutes) all substantially exceeding their non-acceptable thresholds (14400, 7200, 4320, and 2880 minutes, respectively). Although certain repetitive deviations in 'detection' and 'awaiting', and missing 'activation' due to N*RC variants, are not classified as process errors, these activities still critically prolong incident handling. Only 'closure' is within acceptable timeframes.\n\n**Recommendation and Remediation:**\nFocus immediate remediation on these four prolonged phases to reduce their average durations. This should involve reviewing underlying causes such as improving external stakeholder management for the excessive 'awaiting' times, and addressing high repetitions and mismatches in 'activation' and 'resolution' processes."
152,4,"The average activity durations for detection (N: 4d 6h 35min, exceeding nonAcceptableTime of 2880min), activation (A: 8d 18h 55min, exceeding nonAcceptableTime of 7200min), awaiting (W: 16d 8h 10min, exceeding nonAcceptableTime of 14400min), and resolution (R: 5d 22h 11min, exceeding nonAcceptableTime of 4320min) all represent critical process efficiency impediments. While repetitive deviations in 'N' and 'W' may not be considered process errors for the Responder (due to external triggers or third-party control respectively), their average durations still highlight significant bottlenecks impacting incident flow.\n\n**Recommendation:** Urgently investigate the root causes behind the exceptionally long average durations in the Detection, Activation, Awaiting, and Resolution phases.\n\n**Required Remediation:**\n1.  For Detection (N), Activation (A), and Resolution (R), implement internal process streamlining, resource optimization, and training to reduce average activity times.\n2.  For Awaiting (W), given it's often outside direct security operator control, focus remediation on defining clear escalation paths, establishing stricter SLAs with external parties, or exploring automated reminders to mitigate prolonged delays."
152,5,"The average activity durations for Detection (6155 minutes), Activation (12655 minutes), Awaiting (23530 minutes), and Resolution (8531 minutes) severely impede process efficiency, as all significantly exceed their respective non-acceptable time thresholds (2880, 7200, 14400, and 4320 minutes). While repetitive "awaiting" activities and the N\\*RC incident variant are not considered process-harming deviations for responders due to external factors or automated merging, these prolonged durations remain significant bottlenecks impacting overall efficiency. For future reduction, investigate operational inefficiencies within the Detection, Activation, and Resolution processes, and implement strategies to manage or reduce external wait times in the Awaiting state."
152,6,"Average durations for Detection (4d 6h 35min), Activation (8d 18h 55min), Awaiting (16d 8h 10min), and Resolution (5d 22h 11min) remain critical efficiency impediments as they significantly exceed their respective non-acceptable thresholds. For Detection, investigate factors beyond repetitive triggers that prolong the 4-day average, and for Activation, urgently review the nearly 9-day average for incidents that are not auto-merged, as this indicates a severe bottleneck. Although 'Awaiting' repetitions are externally influenced, implement stricter SLAs and proactive escalation for incidents stalled for over 16 days to mitigate process delays. Additionally, address the substantial 5-day average for 'Resolution' to streamline core incident handling activities."
152,7,"While average non-compliance costs for all activities are low (0.00-0.02, falling into the "low" severity range per metric thresholds), the process efficiency is severely impeded by excessive average activity durations. Detection (6155 min), Activation (12655 min), Awaiting (23530 min), and Resolution (8531 min) all significantly exceed their non-acceptable time thresholds (N: >= 2880 min, A: >= 7200 min, W: >= 14400 min, R: >= 4320 min).\n\nRemediation is required to reduce these durations. Focus on improving initial detection procedures to reduce 319 missing Detection incidents. Streamline the Activation process by addressing 544 missing, 1990 repetitions, and 115 mismatches. Although repetitive Awaiting activities are attributed to external factors, the prolonged 23530 min average duration in this state necessitates improved tracking and escalation mechanisms for external dependencies. Additionally, optimize Resolution activities by investigating 119 repetitions and 45 mismatches to enhance efficiency."
152,8,"The average activity durations indicate significant efficiency impediments across multiple stages: Detection (6155 min vs. >=2880 min non-acceptable), Activation (12655 min vs. >=7200 min non-acceptable), Awaiting (23530 min vs. >=14400 min non-acceptable), and Resolution (8531 min vs. >=4320 min non-acceptable). While the cost metric for all activities (0.0-0.02) falls within the 'low' severity range and accounts for special interpretations of repetitive Detection and Awaiting deviations, this discrepancy highlights that current deviation costs do not adequately reflect the severe time inefficiencies. Remediation should focus on root cause analysis for prolonged durations in Activation and Resolution, as these lack specific mitigating context for their deviations, and a review of time thresholds against the cost model's parameterization to better align compliance and efficiency metrics."
152,9,"The average activity durations for Detection (6155 min), Activation (12655 min), Awaiting (23530 min), and Resolution (8531 min) are critically high, significantly exceeding their respective non-acceptable thresholds. Despite this, the average non-compliance costs for these activities (Detection: 0.02, Activation: 0.02, Awaiting: 0.0, Resolution: 0.0) are all within the low severity range and acceptable compliance (<= 0.05). This indicates that while existing deviations are not significantly "process harming" based on the updated cost model and exemptions (e.g., for repetitive detections/awaiting or missing activation due to merges), the prolonged average durations themselves are the primary impediment to process efficiency. Remediation is required to reduce these extensive durations by optimizing workflows, resource allocation, or process steps within Detection, Activation, Awaiting, and Resolution activities, rather than solely focusing on reducing the *number* of now low-impact deviations."
152,10,"While average non-compliance costs for all activities (Detection: 0.02, Activation: 0.02, Awaiting: 0.0, Resolution: 0.0, Closure: 0.0) indicate strong compliance based on the defined cost model and updated deviation interpretations for the Responder, the average activity durations remain a critical impediment to process efficiency. Detection (6155 min), Activation (12655 min), Awaiting (23530 min), and Resolution (8531 min) all significantly exceed their non-acceptable time thresholds of 2880 min, 7200 min, 14400 min, and 4320 min, respectively.

**Required Remediation:**
Despite deviations related to repetitive Detection and Awaiting activities, or N*RC variants being exempt from process error assessment for the Responder, the exceptionally long durations in these stages (especially ""Awaiting"" at over 16 days) severely impact overall incident lifecycle and resource utilization. Responders should focus on optimizing handovers, clarifying external dependencies, and identifying specific bottlenecks within Detection, Activation, and Resolution to reduce these prolonged durations, ensuring that incidents progress more swiftly through the pipeline."
153,1,"All 7 listed incidents are critically non-compliant based on the 'cost' metric, with INC0033952 showing the highest cost at 0.81. A technical analysis of incidents reveals persistent patterns of `Impact=2`, `Urgency=2`, `Priority=3`, predominantly linked to `Symptom 491`, `Locations 204, 143, 161`, and `Categories 46, 42, 26, 53, 23, 57, 9, 34`. However, a true deep dive into non-compliance and the drift between theoretical and practical processes, as required by the Analyst role, is hindered. The provided data lacks granular detail on specific deviation types (missing, repetition, mismatch) per activity for each incident, making it impossible to differentiate between newly acceptable deviations (e.g., repetitive detections/awaiting or N*RC variants) and actual process errors.

**Remediation for Insufficient Data:** To enable a proper deep dive and targeted remediation, provide detailed breakdowns of deviation types (missing, repetition, mismatch) for each activity (detection, activation, awaiting, resolution, closure) per critical incident. This will allow the Analyst to accurately assess process non-compliance under the revised compliance rules."
