control_id,iteration,recommendation
154,5,"The technical analysis data highlights Symptom 491, Category 46, and Location 204 as the most frequently occurring attributes, providing the necessary statistics for the 'Report Technical Analysis and most affected categories' control. However, all incidents in the selected period demonstrate critical process non-compliance (fitness values ranging from 0.19 to 0.5), indicating significant deviations from the reference model. Remediation should focus on an in-depth analysis of these widespread process non-compliances to identify root causes and ensure the consistency and accuracy of technical data collection and reporting. This will directly improve overall incident management compliance."
154,6,"The provided data successfully enables reporting of technical statistics as required by the control. Analysis shows that symptom `491` (202 occurrences), category `46` (82 occurrences), and location `204` (154 occurrences) are the most frequently recorded.

**Recommendation:**
As an Analyst, focus on investigating the root causes behind the high frequency of symptom `491`, category `46`, and incidents at location `204` to pinpoint the most targeted IT assets or infrastructure. Additionally, address the 70 incidents with unrecorded symptoms (`None`) to ensure comprehensive data for future analysis and compliance."
154,7,"Overall process compliance is critically low, with all recorded incidents exhibiting fitness values in the range of 0.19 to 0.5, falling entirely within the 'critical' threshold. Technical analysis indicates that Symptom 491 (172 occurrences), Category 46 (55 occurrences), and Location 204 (110 occurrences) are the most frequently reported attributes among these incidents. An in-depth root cause analysis for incidents linked to Symptom 491, Category 46, and Location 204 is urgently required to deduce frequently targeted IT assets and infrastructures, and inform targeted remediation efforts to improve overall incident management compliance."
154,8,"The incidents exhibit critical process compliance with fitness scores ranging from 0.19 to 0.50, all falling into the 'critical' severity level. Technical analysis reveals that Symptom 491 is the most frequent, followed by Symptom 534. Location 204 is the most affected (119 incidents), while Categories 46 (71 incidents) and 42 (63 incidents) are the most frequently targeted.

To improve incident management compliance, investigate the root causes behind the high occurrence of Symptom 491 and 534, focusing on IT assets in Location 204 and addressing issues within Categories 46 and 42. Analyzing these specific technical attributes can help identify underlying vulnerabilities or operational weaknesses that lead to frequent deviations from the reference model."
154,9,"The incident management compliance analysis for the 'Analyst' role regarding ""Report Technical Analysis and most affected categories"" reveals several key trends. Symptom '491' (198 occurrences), Category '46' (100 occurrences), and Location '204' (122 occurrences) are overwhelmingly the most frequently observed attributes. This indicates that a significant number of incidents share common technical characteristics and are concentrated in specific areas, suggesting potential vulnerabilities or recurring issues within those IT assets or infrastructures.

**Recommendation:**
The organization should prioritize an in-depth root cause analysis for Symptom '491', incidents categorized as '46', and those occurring at Location '204'. This targeted analysis, focusing on these high-frequency attributes, will allow the Analyst to deduce frequently targeted IT assets and infrastructures, leading to more effective remediation strategies and improved overall incident management compliance."
154,10,"All analyzed incidents exhibit critical process fitness (0.19 to 0.5), indicating severe deviations from the reference model. Technical analysis reveals that 'symptom 491' is the most frequent (173 occurrences), alongside a significant number of incidents (104) lacking symptom details. Locations '204' (140 incidents), '143' (104 incidents), and '161' (103 incidents) are most affected, while categories '46' (78 incidents), '26' (63 incidents), and '53' (52 incidents) are most impacted.

**Recommendation / Required Remediation:**
As an Analyst, immediate remediation is required for data quality by enforcing mandatory symptom reporting to eliminate ""None"" entries. Further, conduct in-depth root cause analysis for symptom '491' and prioritize investigations for IT assets and infrastructure in locations '204', '143', '161' and categories '46', '26', '53' to improve process compliance."
