control_id,iteration,recommendation
153,2,"The top 7 incidents, led by INC0033952 with a non-compliance cost of 0.81, are all in the 'critical' range (0.3 - 2.0), indicating severe process deviations according to the cost metric. Technical analysis consistently reveals a pattern of `Impact 2, Urgency 2, Priority 3`, with recurring `Symptom 491`, `Location 204`, and `Category 46`, suggesting systemic issues in these incident types.

However, a deep dive into *specific* risks and remediation, as required by the Analyst role and the new environment tunings, is currently constrained. The provided compliance cost per incident does not break down the contributing deviation types (missing, repetition, mismatch for detection, activation, awaiting, resolution, closure). Without this granular data, it is impossible to accurately re-evaluate non-compliance in light of the clarified acceptable repetitive detection and awaiting activities or the N*RC variants, which are now considered non-process-harming deviations.

**Recommendation:** To improve incident management compliance, it is crucial to obtain detailed deviation type breakdowns (missing, repetition, mismatch) per activity for each critical incident. This will enable a precise assessment, allowing for the correct application of the tuned thresholds and exemptions, and facilitate targeted remediation actions or further adjustments to the reference model for specific non-compliant patterns like `Symptom 491`, `Location 204`, and `Category 46`."
153,3,"The most critical incidents, with costs ranging from 0.31 to 0.81, all fall within the 'critical' compliance severity level (cost >= 0.3), indicating significant non-compliance. While technical attributes show commonalities such as symptom 491 and location 204, the provided data lacks specific breakdown of deviation types (missing, repetition, mismatch) and affected process activities for each incident. Therefore, it is currently impossible to determine if the high non-compliance costs are due to actual process errors or the newly clarified 'acceptable' deviations (e.g., repetitive detection/awaiting, N*RC variant). To enable a deep dive and targeted remediation, granular data on the specific deviations contributing to the cost for each critical incident is required."
153,4,"All listed incidents are critically non-compliant by cost (e.g., INC0033952 at 0.81), posing severe risks from process deviations. As an Analyst, a deep dive into their traces is crucial, focusing on missing, repetition, and mismatch deviations, but *excluding* repetitive 'Detection' deviations, 'N*RC' variants, and repetitive 'Awaiting' activities (which, despite a 0.1 cost, are outside security operator control) from process error consideration. Prioritize investigating root causes for the prevalent non-compliance in incidents with Impact 2, Urgency 2, Priority 3, and critically review high-severity (Impact 1, Urgency 1, Priority 1) incident handling to resolve true process drifts and mitigate security risks."
153,5,"The most critical incidents, such as INC0033952 (cost: 0.81) and INC0025696 (cost: 0.41), exhibit 'critical' non-compliance (cost >= 0.3), indicating significant process deviations. These risks could lead to inefficient incident resolution and increased security vulnerabilities. As an Analyst, focus root cause analysis on the 109 incidents with missing symptom data, as this points to fundamental gaps in initial recording. Furthermore, prioritize investigating process flows related to Symptom 491 (172 occurrences), Location 204 (118 occurrences), and Category 46 (71 occurrences) to uncover specific deviations, while acknowledging that repetitive detection and awaiting deviations, or N*RC variants, are now considered acceptable and not indicative of process errors."
153,6,"The provided data indicates seven incidents are critically non-compliant, with costs ranging from 0.31 to 0.81, falling within the new critical threshold (>= 0.3). These incidents, some of which also exhibit high technical priority (Impact=1, Urgency=1, Priority=1), pose significant risks of inefficient handling and prolonged resolution.

However, the current 'most_critical_incidents' view only provides an aggregate cost per incident, which is insufficient for an Analyst to perform the required deep dive into activity specifics and process drift. Without a detailed breakdown of deviation types (missing, repetition, mismatch) and the specific activities (detection, activation, awaiting, resolution, closure) contributing to each incident's cost, it's impossible to apply the new tunings (e.g., disregarding repetitive detection or awaiting activities, or N*RC variants) to accurately identify actionable process errors.

**Required Remediation:** To enable effective analysis and remediation, the 'most_critical_incidents' data must be augmented to include a detailed breakdown of the compliance cost by deviation type and activity for each incident. This granular information is crucial for the Analyst to pinpoint true process non-compliance and recommend targeted improvements."
153,7,"All seven listed incidents are critically non-compliant, with INC0033952 having the highest non-compliance cost at 0.81, followed by INC0025696, INC0026744, and INC0032450 at 0.41, based on the updated cost metric (critical: >= 0.3). However, a deep dive into the specific reasons for non-compliance (missing, repetition, mismatch) for these incidents is not possible with the provided data, which prevents the application of the updated compliance interpretations regarding repetitive detection/awaiting activities or N*RC variants.

To effectively assess the compliance and identify root causes from an Analyst's perspective, detailed data for each critical incident is required, specifically outlining the types of deviations (missing, repetition, mismatch) for each process activity (detection, activation, awaiting, resolution, closure). Additionally, linking technical attributes (Symptom, Impact, Urgency, Priority, Location, Category) to these individual critical incidents would enable a more targeted analysis of the drift between theoretical and practical processes."
153,8,"The top 7 incidents, with costs ranging from 0.31 to 0.81, are critically non-compliant. However, this high non-compliance cost is significantly influenced by repetitive detection and awaiting activities, which are considered acceptable deviations due to automated merging (N*RC variants) or external dependencies, as indicated by the tuned environment thresholds. Technical analysis of 772 critical incidents shows they predominantly share Impact 2, Urgency 2, Priority 3, and are frequently linked to locations 204, 143, 161, 93, 51 and categories 46, 42, 53, 26, 9.

This reveals a drift between the theoretical process model and practical operations; the main risk is that these ""acceptable"" deviations inflate overall non-compliance, potentially obscuring actual process errors like missing steps or mismatches. Remediation requires refining the compliance model to reflect these operational realities by de-emphasizing penalties for the noted repetitions. A targeted deep dive should then focus on identifying and resolving genuine missing or mismatch deviations within the identified hotspot locations and categories to improve compliance where actual operator control exists."
153,9,"The most critical non-compliant incident, INC0033952 with a cost of 0.81, demonstrates severe process deviations based on the updated cost metric, falling into the critical severity range. An in-depth analysis should prioritize investigating missing or mismatched 'Resolution' (R) and 'Closure' (C) activities, which carry the highest non-compliance costs (R missing: 0.45, C missing: 0.3; R mismatch: 0.3), while de-emphasizing repetitive 'detection' and 'awaiting' deviations due to updated thresholds and operational contexts. Technical analysis reveals common attributes such as Symptom 491, Location 204, and Category 46, often associated with a priority of 3 (Impact 2, Urgency 2), indicating a systemic process drift for these specific types of incidents. Remediation requires identifying why 'Resolution' and 'Closure' steps are being genuinely missed or incorrectly applied for incidents sharing these technical characteristics, and improving initial data capture to reduce instances of missing symptom data."
153,10,"The assessment identifies 7 incidents with critically high non-compliance costs (0.31 to 0.81), indicating significant process risks. However, applying the updated compliance rules to precisely explain these risks and resolve non-compliance through activity specifics (e.g., excluding certain repetitions or N*RC flows) is currently impossible without granular cost data per deviation type and activity for each incident. To enable a targeted deep-dive and effective remediation, obtaining this detailed breakdown is essential. Concurrently, technical analysis highlights prevalent Impact 2/Urgency 2/Priority 3, frequent Symptom 491, and 127 incidents with no recorded symptom, which warrant immediate investigation into underlying process or technical issues."
154,1,"The technical analysis correctly identifies frequent symptom 491 (302 times), locations 204 (108 times), 161 (80 times), 143 (79 times), and categories 46 (102 times), 42 (67 times), 26 (61 times), satisfying the control's reporting goal. However, 104 incidents lacking symptom data (""None"") severely hinder root cause analysis, a critical gap for the Analyst role, unaffected by recent adjustments to process deviation interpretations. Despite refined interpretations for specific process deviations (e.g., repetitive detection, N*RC flows, repetitive awaiting), incidents like INC0033952 (cost 0.81) still present critical non-compliance costs, demanding technical investigation for underlying issues.

**Recommendation:**
1.  **Improve Data Quality:** Mandate comprehensive symptom reporting for all incidents to address the 104 missing entries, enabling more accurate technical analysis.
2.  **Focus Technical Investigations:** Conduct in-depth root cause analysis on incidents with symptom 491 and those affecting locations 204, 161, 143, and categories 46, 42, 26 to identify systemic technical issues.
3.  **Prioritize Critical Incidents:** Perform a targeted technical deep dive into high-cost incidents, starting with INC0033952 (cost 0.81), to understand their specific technical drivers regardless of adjusted process compliance interpretations."
154,2,"The control ""Report Technical Analysis and most affected categories"" is partially met as the raw technical data for analysis is provided. As an Analyst, an aggregation of this data reveals that Symptom 491 (198 occurrences), Location 204 (172 occurrences), and Category 42 (67 occurrences) are the most frequent attributes. Symptom 534 (42) and Symptom 517 (21) are the next most common symptoms, while Locations 143 (88) and 161 (82) and Categories 46 (62) and 26 (59) also appear frequently.

**Required Remediation:**
To achieve full compliance, it is necessary to formally generate a regular report that explicitly aggregates these technical statistics. This report should clearly present the most affected symptoms (e.g., Symptom 491, 534, 517), locations (e.g., Location 204, 143, 161), and categories (e.g., Category 42, 46, 26) to systematically deduce frequently targeted IT assets and infrastructures. The presence of many `None` values for symptom attributes also indicates a need to improve data completeness at the point of incident recording."
154,3,"For the ""Report Technical Analysis and most affected categories"" control, technical statistics indicate Symptom 491 (172 incidents), Locations 204 (111 incidents) and 161 (104 incidents), and Categories 46 (68 incidents) and 26 (66 incidents) are most prevalent, suggesting areas for focused technical investigation of IT assets. A critical data gap exists, with 65 incidents lacking recorded symptoms, which severely hinders comprehensive technical analysis and root cause identification, even as overall process compliance is evaluated by cost. Remediation requires immediate enforcement of mandatory symptom recording to improve data quality for meaningful analysis and to fully deduce frequently targeted IT assets. Further investigation into the technical reasons for these high-frequency symptoms and locations, particularly for repetitive detection activities (irrespective of their process compliance score impact), is crucial for enhancing incident management insights."
154,4,"The provided `technical_analysis` data is sufficient for the Analyst to report technical statistics related to occurring symptoms, affected categories, and locations. Analysis of the data reveals that the most frequent symptom is 'None' (70 occurrences), followed by Symptom 491 (67 occurrences). Category 46 (104 occurrences) and Location 204 (171 occurrences) are the most frequently affected. This statistical breakdown enables the deduction of frequently targeted IT assets and infrastructures, thereby fulfilling the ""Report Technical Analysis and most affected categories"" control's objective. No remediation is required for insufficient data to generate this report, as the compliance metric changes and deviation tunings are not directly applicable to the content required by this specific control."
154,5,"**Recommendation:**
The control 'Report Technical Analysis and most affected categories' is adequately met, as the provided technical analysis data clearly identifies prevalent symptoms (e.g., 491), locations (e.g., 204), and categories (e.g., 42, 46, 23, 53, 26), which allows for deduction of frequently targeted IT assets.

**Required Remediation:**
Despite the availability of technical reporting data, all listed incidents exhibit critical process non-compliance costs (ranging from 0.31 to 0.81), indicating severe underlying process deviations. A thorough, in-depth root cause analysis is required for these specific high-cost incidents. This analysis must distinguish true process errors from the newly defined acceptable repetitive 'detection' (acceptableRepetition <= 5000) and 'awaiting' activities (acceptableRepetition <= 2000), as well as the non-erroneous N*RC process variant, to ensure remediation targets actual non-compliance.

**Output for Insufficient Data:**
To facilitate a more precise root cause analysis by the Analyst, detailed process traces or a breakdown of specific deviation types (missing, repetition, mismatch) and their costs per individual incident would be beneficial. This would allow for direct correlation between the identified frequently targeted IT assets and the actual non-compliant process activities, aligning with the updated compliance metric and environmental tunings."
154,6,"The provided data successfully enables reporting of technical statistics as required by the control. Analysis shows that symptom `491` (202 occurrences), category `46` (82 occurrences), and location `204` (154 occurrences) are the most frequently recorded. As an Analyst, focus on investigating the root causes behind these high frequencies to pinpoint the most targeted IT assets or infrastructure. Additionally, address the 70 incidents with unrecorded symptoms (`None`) to ensure comprehensive data for future analysis, as this information is crucial for technical deduction and cannot be derived from the updated process compliance metrics or deviation interpretations."
154,7,"Overall compliance, as measured by the 'cost' metric, indicates several incidents are in the 'critical' severity range (cost >= 0.3), with INC0033952 at 0.81, and others like INC0025696, INC0026744, INC0032450 (all 0.41) also showing significant non-compliance. From a technical analysis perspective, Symptom 491 (172 occurrences), Category 46 (55 occurrences), and Location 204 (110 occurrences) are the most frequently reported attributes, indicating consistently targeted IT assets. As an Analyst, an in-depth technical investigation into these prevalent symptoms, categories, and locations is crucial to identify root causes and underlying vulnerabilities, regardless of process deviation classifications. While repetitions in detection activities or awaiting states are now considered less critical for process compliance due to adjusted thresholds and merge rules, their frequent occurrence still signals areas needing detailed technical scrutiny for proactive security improvements."
154,8,"The analysis of critical incidents, based on the 'cost' metric, indicates high non-compliance, with all identified incidents falling into the 'critical' severity range (0.31 to 0.81). Technical analysis reveals Symptom 491 (104 occurrences) and 'None' (75 occurrences) as most frequent, with Location 204 (119 incidents) and Category 46 (71 incidents) being the most affected. As an Analyst, investigate the root causes of these frequent technical attributes, particularly Symptom 491, within Location 204 and Category 46 to improve compliance. Additionally, address the significant number of incidents with 'None' for symptom, as this data quality issue hinders effective root cause analysis."
154,9,"The technical analysis for the 'Analyst' role reveals that Symptom '491' (198 occurrences), Category '46' (100 occurrences, tied with categories '53' and '26'), and Location '204' (122 occurrences) are the most frequently observed technical attributes. While recent adjustments to compliance metrics and interpretations for repetitive process deviations (e.g., detection, awaiting activities, N*RC variants) mitigate their impact on overall process non-compliance cost, these frequent technical occurrences remain critical for security analysis. The Analyst should focus on these high-frequency attributes to conduct an in-depth root cause analysis, thereby deducing frequently targeted IT assets and infrastructures for effective remediation."
154,10,"Seven incidents exhibit critical non-compliance costs ranging from 0.31 to 0.81, indicating severe deviations from the reference model. Technical analysis reveals 'symptom 491' as the most frequent (173 occurrences), with 104 incidents lacking symptom details. Locations '204' (140 incidents), '143' (104 incidents), and '161' (103 incidents) are most affected, while categories '46' (78 incidents), '26' (63 incidents), and '42' (60 incidents) are most impacted.

**Recommendation / Required Remediation:**
As an Analyst, immediate remediation is required for data quality by enforcing mandatory symptom reporting to eliminate ""None"" entries. Further, conduct in-depth root cause analysis for symptom '491' and prioritize investigations for IT assets and infrastructure in locations '204', '143', '161' and categories '46', '26', '42' to improve process compliance."
