control_id,iteration,recommendation
148,1,"The incident management process currently exhibits moderate overall compliance with an average fitness of 0.6948. However, a critically low SLA attainment rate of 44.43% reveals significant failures in meeting contractual obligations. While active incidents decreased positively from 1963 to 451, a substantial portion of the 1598 closed incidents show poor compliance, with 323 classified as High and 216 as Critical severity. Immediate remediation is required to improve SLA adherence and process compliance for these high and critical severity incidents. Additionally, the reported opening of only 5 new incidents during the period, contrasting sharply with the volume of active and closed cases, necessitates an investigation into data accuracy for incident creation."
148,2,"The incident management process shows moderate compliance with an average fitness of 0.69. While active incidents decreased significantly from 1963 to 451, and 1598 incidents were closed (33.7% of which were high or critical severity), a critical concern is that only 44.43% of incidents met their SLA. Remediation must prioritize investigating the root causes for the low SLA adherence and the exceptionally high average resolution time of 21807.82 minutes to ensure contractual obligations are met."
148,3,"The incident management process shows moderate compliance with an average fitness of 0.69, falling within the `>= 0.65 AND < 0.85` range. However, a significant concern is the low SLA adherence, with only 44.43% of incidents meeting their contractual obligations, despite a positive trend of active incidents decreasing from 1963 to 451 within the period. The closure of 323 high and 216 critical severity incidents, along with an average resolution time of approximately 15 days, suggests a need to investigate the reasons for SLA non-compliance, particularly for higher-severity incidents, to improve service delivery and meet contractual commitments."
148,4,"The incident management process exhibits a concerningly low SLA adherence of 44.43%, despite achieving a moderate average process fitness of 0.69 during the period. Of the 1598 incidents closed, a significant 33.7% (540 incidents) were classified with high or critical process compliance severity, indicating substantial deviations from the reference model for these cases. While the number of active incidents decreased from 1963 to 451, Immediate remediation is required to investigate the root causes of the low SLA achievement and improve compliance, especially for incidents with high and critical severities."
148,5,"During the period, active incidents significantly decreased from 1963 to 451, with 5 new incidents opened and 1598 incidents closed. The overall process compliance is moderate at 0.69 (within the 0.65-0.85 range), but a critical issue is that only 44.43% of incidents met their SLA, indicating a significant breach of contractual obligations. Among the closed incidents, 497 were low, 562 moderate, 323 high, and 216 critical in severity. Immediate remediation is required to improve SLA adherence, particularly for high and critical severity incidents, and to elevate process compliance above the moderate level."
148,6,"The incident management compliance indicates significant issues for management oversight. Only 44.43% of incidents met SLA requirements, directly signaling a failure in meeting contractual obligations. While active incidents decreased from 1963 to 451 during the period, the average process fitness of 0.69 is only at a moderate compliance level, highlighting notable deviations from the defined reference model. Remediation efforts should prioritize improving SLA adherence and investigating the causes for moderate process compliance and the lengthy average time to resolve incidents (over 15 days)."
148,7,"For the selected period, incident management shows a net decrease in active incidents from 1963 to 451, with only 5 new incidents recorded and 1598 incidents closed, categorized primarily as moderate (562) and low (497) severity. However, contractual obligations are severely unmet, as only 44.43% of incidents adhered to their SLA, and overall process fitness is moderate at 0.6948. Remediation is critically needed to investigate the root causes of low SLA performance and moderate process deviations to ensure compliance with policies and contractual commitments."
148,8,"The incident management process demonstrates moderate compliance (fitness 0.69), but critically underperforms on contractual obligations with only 44.43% of SLAs met and an average resolution time exceeding 15 days (21807.82 minutes). A significant concern is that 0% of incidents were resolved by the assigned person, pointing to severe handoff issues, while 33.7% of closed incidents were of high or critical severity. Remediation must prioritize investigating and improving SLA attainment and reducing the average time to resolve by addressing process bottlenecks and ensuring better incident ownership. Additionally, clarify the 'opened incidents' metric for accurate new incident tracking within the reporting period, as only 5 new incidents are recorded against 1598 closed incidents."
148,9,"The incident management compliance shows a moderate process fitness of 0.69, which is acceptable but leaves room for improvement. However, a critical concern is the low SLA adherence rate of only 44.43%, indicating that most incidents are not resolved within contractual obligations, with an average resolution time of approximately 15 days. Additionally, 33.7% of all incidents closed in the period (539 out of 1598) were of high or critical severity. Remediation must focus on identifying and resolving bottlenecks in the process that lead to prolonged resolution times, especially for high and critical incidents, to significantly improve SLA compliance."
148,10,"For the reporting period, incident management shows a **moderate process fitness of 0.69**, indicating reasonable but improvable adherence to the reference model. A critical concern is the **low SLA achievement rate of 44.43%**, directly impacted by the **high average time to resolve incidents (21807.82 minutes or ~15.14 days)**. While only 5 new incidents were opened, active incidents significantly reduced from 1963 to 451, and 1598 incidents were closed, including 216 critical ones. Remediation should prioritize initiatives to analyze and optimize the resolution phase, particularly for moderate and critical incidents, to improve both process fitness and meet contractual SLA obligations."
149,1,"The incident management process demonstrates significant non-compliance, with states like Detection, Activation, and Awaiting exhibiting excessive repetitions (1777, 1990, and 1653 respectively) and average durations (e.g., Awaiting at 16d, 8h, 10min) that far exceed non-acceptable thresholds. Critical deviations also include frequent missing 'Detection' (319) and 'Activation' (544) states, alongside invalid transitions such as N->W and N->R, bypassing the 'activation' state as seen in common variants like ""N R C"" (182 occurrences).

**Required Remediation:**
Investigate the root causes for the widespread process deviations, particularly frequent state repetitions, unauthorized state skips (like N->W and N->R), and implement measures to reduce the excessive average durations across all states except closure. Focus on enforcing adherence to the defined reference model to improve overall compliance."
149,2,"The incident management process shows significant non-compliance with the defined reference model. Notably, unauthorized transitions from 'detection' (N) to 'resolution' (R, avg 2d 16h 34min) and 'awaiting' (W, avg 1d 0h 45min) occur frequently, as these paths are not allowed by the PNML model. High repetition counts in 'detection' (1777), 'activation' (1990), and 'awaiting' (1653), alongside numerous missing 'activation' activities (544 instances), indicate substantial process deviations. Furthermore, the 'awaiting' state exhibits an exceptionally long average duration of 16 days, 8 hours, 10 minutes, and the 'resolution' to 'closure' transition averages 5 days, 0 hours, 4 minutes, highlighting significant bottlenecks. Remediation is required to enforce adherence to the sequential process flow (N->A) and to investigate and optimize the prolonged durations and frequent repetitions in specific states."
149,3,"The incident management process exhibits significant compliance issues with the reference model. Most notably, non-compliant transitions from 'detection' (N) directly to 'resolution' (R) and 'awaiting' (W) are prevalent, as seen with the top variant ""N R C"" occurring 182 times, which deviates from the required N->A path. Additionally, there are very high rates of state repetition for 'detection' (1777), 'activation' (1990), and 'awaiting' (1653), indicating frequent unmodeled loops in the process. Actionable remediation is required to enforce the defined `N->A` transition and investigate the causes of state repetitions and the excessive 16-day average duration for the 'awaiting' state."
149,4,"The incident management process exhibits severe compliance issues. The average durations for 'detection' (4d 6h 35min), 'activation' (8d 18h 55min), 'awaiting' (16d 8h 10min), and 'resolution' (5d 22h 11min) all critically exceed their acceptable time thresholds. Process deviations are excessively high for 'repetition' in states N (1777), A (1990), W (1653), and R (119), alongside significant 'missing' (544) and 'mismatch' (115) counts for 'activation'.

**Required Remediation:** Immediate remediation is needed to address the prevalent non-compliant process flows, notably the ""N R C"" variant (182 occurrences) which bypasses critical 'activation' and 'awaiting' stages not permitted by the reference model. Investigate the root causes of these deviations and the prolonged state durations to enforce adherence to the defined incident management reference model and improve overall process efficiency."
149,5,"The incident management process exhibits critical non-compliance and severe inefficiencies. The pervasive deviations, especially high missing (N: 319, A: 544) and repetition (N: 1777, A: 1990, W: 1653, R: 119) counts, significantly exceed acceptable thresholds, indicating a breakdown in process adherence. Furthermore, average state durations for Detection (6035 min), Activation (12895 min), Awaiting (23530 min), and Resolution (8531 min) critically exceed non-acceptable times (e.g., Detection non-acceptable >= 2880 min), highlighting severe bottlenecks. Remediation is required to enforce process steps and identify root causes for these significant delays and deviations in the detection, activation, awaiting, and resolution phases."
149,6,"The incident management process exhibits critical non-compliance, with deviation counts for `missing` (N: 319, A: 544), `repetition` (N: 1777, A: 1990, W: 1653, R: 119), and `mismatch` (A: 115, R: 45) significantly exceeding acceptable thresholds. The most frequent process variant, 'N R C' (182 occurrences), and recorded `N->W` and `N->R` average transition times directly bypass the 'activation' state, a major deviation from the reference model. Remediation is required to enforce adherence to the defined process flow, ensuring incidents pass through 'activation' (A) and reducing excessive state repetitions. Additionally, the prolonged average duration of 16 days, 8 hours, 10 minutes in the 'awaiting' (W) state should be investigated as a significant bottleneck."
149,7,"The incident management process shows critical compliance issues as the most frequent variant 'N R C' (182 occurrences) indicates a significant unmodeled bypass from 'Detection' (N) to 'Resolution' (R), violating the defined reference model. Average durations for 'Detection' (4d 6h 35min), 'Activation' (8d 18h 55min), 'Awaiting' (16d 8h 10min), and 'Resolution' (5d 22h 11min) critically exceed non-acceptable thresholds, indicating severe bottlenecks. Furthermore, 'missing', 'repetition', and 'mismatch' deviation counts are excessively high for most states (N: 319 missing, 1777 repetition; A: 544 missing, 1990 repetition, 115 mismatch; W: 1653 repetition; R: 119 repetition, 45 mismatch), signaling widespread non-adherence.

**Required Remediation:**
Investigate the prevalent N->R bypass and other unmodeled transitions, urgently address the excessive average durations in Detection, Activation, Awaiting, and Resolution states, and determine the root causes of the critically high deviation counts across multiple process states."
149,8,"The incident management process exhibits severe compliance issues against the reference model. Critical deviations are widespread: detection (N) and activation (A) states show high counts of missing, repetition, and mismatch deviations (e.g., N missing 319 vs. <=20, A repetition 1990 vs. <=500), far exceeding acceptable thresholds. Furthermore, average durations for detection, activation, awaiting, and resolution are critically long, significantly surpassing non-acceptable time limits (e.g., Detection avg. 4d, 6h vs. >=2880min non-acceptable), and non-compliant transitions like 'N->W' and 'N->R' are occurring. Immediate remediation is required to investigate the root causes of these extensive deviations and enforce adherence to the defined process flow, particularly focusing on reducing delays and preventing skipped or repeated activities in the initial phases."
149,9,"The incident management process demonstrates critical non-compliance with the reference model. Average state durations for `detection` (6155 min), `activation` (12655 min), `awaiting` (23530 min), and `resolution` (8531 min) are significantly beyond non-acceptable thresholds. Furthermore, there are pervasive process deviations with high repetitions for `detection` (1777), `activation` (1990), and `awaiting` (1653), and significant mismatches for `activation` (115) and `resolution` (45). Remediation is urgently required to investigate and enforce adherence to defined state transitions (e.g., eliminating observed `N->R` and `N->W` paths), reduce excessive state durations, and ensure incidents consistently follow the full lifecycle from `detection` to prevent skipping initial stages."
149,10,"Based on the Monitor role, the incident management process shows significant compliance issues within the selected period. Average state durations for 'detection', 'activation', 'awaiting', and 'resolution' are critically above their acceptable thresholds, indicating severe process bottlenecks. Furthermore, high counts of 'missing' (N, A), 'repetition' (N, A, R, W), and 'mismatch' (A, R) deviations, alongside unauthorized 'detection' to 'awaiting' (N->W) and 'detection' to 'resolution' (N->R) transitions, highlight frequent non-compliant process executions. Remediation requires immediate investigation into these prolonged state times and the root causes of the widespread process deviations and model violations to enforce adherence."
150,1,"The most frequent recorded variant is ""N R C"" (182 incidents), indicating a critical non-compliance where incidents transition directly from Detection to Resolution, bypassing the required Activation state in the reference model. This suggests a systemic issue in adherence to the defined process. The third most frequent variant, ""N N R C"" (81 incidents), further highlights high repetition in the Detection state (1777 occurrences for 'N') before exhibiting the same non-compliant N->R transition. Remediation requires investigating the operational reasons for skipping activation and enforcing process steps or updating the reference model if this path is an intended, but currently unmodeled, flow."
150,2,"The most frequent recorded variants reveal significant non-compliance, with `N R C` (182 incidents) bypassing the 'activation' and 'awaiting' states, and `A R C` (135 incidents) starting directly at 'activation' without 'detection'. Repetitions of states 'N' (e.g., `N N R C` - 81 incidents) and 'A' (e.g., `N A A R C` - 46 incidents) are also highly common, indicating potential rework or re-evaluation loops. The only fully compliant path among the top variants is `N A R C` (59 incidents), which skips 'awaiting' but follows allowed transitions. A remediation is required to investigate why 'detection', 'activation', and 'awaiting' states are frequently skipped or repeated, suggesting a need for process re-enforcement and user training to align actual incident handling with the reference model's intended flow."
150,3,"As a Monitor, the most frequent recorded incident variants reveal significant deviations from the reference model. The top variant, ""N R C"" (182 occurrences), indicates incidents directly moving from detection to resolution, bypassing activation and awaiting states. Similarly, ""A R C"" (135 occurrences) skips detection entirely, initiating at activation, while ""N N R C"" (81 occurrences) shows repeated detection before resolution, again bypassing activation and awaiting. These patterns are more prevalent than the compliant ""N A R C"" (59 occurrences) and ""N A W R C"" (26 occurrences) paths. Required remediation: Investigate why 'detection', 'activation', and 'awaiting' states are consistently bypassed or repeated in these frequent variants, ensuring process adherence and accurate logging across all incident stages."
150,4,"The most frequent incident management variants are 'N R C' (182 incidents) and 'A R C' (135 incidents), which significantly deviate from the reference model by often skipping the 'activation' and 'awaiting' states. The fully compliant variant 'N A R C' is less frequent with 59 occurrences. This indicates a widespread pattern of non-compliance where critical initial and intermediate process stages are frequently bypassed, necessitating investigation into why incidents are not following the defined 'N -> A -> W -> R -> C' or 'N -> A -> R -> C' paths. Remediation should focus on enforcing the proper inclusion of the 'activation' and 'awaiting' phases in incident workflows to improve process adherence."
150,5,"The most frequent variant, 'N R C' (182 incidents), reveals a significant non-compliance where incidents bypass the 'activation' state, moving directly from 'detection' to 'resolution', which is not allowed by the reference model. This is supported by 544 missing 'activation' events. The second most frequent compliant path is 'A R C' (135 incidents), leveraging the allowed 'activation' to 'resolution' skip. Additionally, variants like 'N N R C' (81 incidents) show frequent repetitions in the 'detection' state (1777 total 'N' repetitions), indicating potential re-evaluation cycles.

**Required Remediation:**
Investigate the root cause for the frequent skipping of the 'activation' state and enforce adherence to the reference model or reassess its suitability. Furthermore, analyze the reasons behind the high number of 'detection' repetitions to identify and resolve underlying process inefficiencies."
150,6,"The most frequent incident variant is 'N R C' (182 occurrences), which deviates from the reference model by skipping the 'activation' (A) state. The second most common variant, 'A R C' (135 occurrences), suggests incidents frequently start at 'activation', potentially missing the 'detection' (N) state, which aligns with 319 missing 'N' events. While 'N A R C' (59 occurrences) is a compliant path, the dominance of non-compliant direct jumps from 'N' to 'R' and high repetitions in 'N' (e.g., 'N N R C' with 81 occurrences) indicates significant process non-conformance. Remediation should focus on enforcing the 'detection' to 'activation' transition and reducing state repetitions."
150,7,"The most frequent recorded variants reveal significant non-compliance, demonstrating major deviations from the reference model. The top variant, 'N R C' (182 incidents), directly skips the mandatory 'activation' phase, indicating a systematic bypass. Additionally, 'A R C' (135 incidents) frequently bypasses the initial 'detection' state, while 'N N R C' (81 incidents) shows unauthorized repetitions in the detection phase. These patterns highlight critical process adherence issues, particularly around the 'detection' and 'activation' states, and require immediate investigation to enforce the defined incident management workflow."
150,8,"The most frequent recorded variants are 'N R C' (182 incidents), 'A R C' (135 incidents), and 'N N R C' (81 incidents). Critically, 'N R C' and 'N N R C' are non-compliant, as they exhibit an N->R transition, bypassing the mandatory 'activation' (A) state required by the reference model after 'detection' (N). The repetition in 'N N R C' also highlights an unmodeled deviation in the detection phase. As a Monitor, it is recommended to investigate the root cause for frequently skipping 'activation' and the high frequency of 'N' state repetitions to ensure process adherence and improve compliance."
150,9,"The most frequent recorded incident variant is 'N R C' (182 incidents), which is non-compliant as it skips the mandatory 'activation' state (A) after 'detection' (N). The second most frequent, 'A R C' (135 incidents), is also non-compliant by bypassing the initial 'detection' state (N). These observations, combined with 544 missing 'activation' and 319 missing 'detection' events, indicate a systemic issue where incidents frequently do not follow the defined process flow, particularly concerning initial stages. Remediation requires investigation into why 'activation' and 'detection' states are often skipped or missing."
150,10,"The most frequent variants, 'N R C' (182 occurrences) and 'A R C' (135 occurrences), are non-compliant with the reference model. 'N R C' indicates a bypass of the 'activation' (A) state after detection, while 'A R C' suggests incidents are initiated directly at 'activation', omitting the 'detection' (N) phase. The fully compliant 'N A R C' variant only represents 59 incidents, demonstrating widespread deviation from the prescribed process flow. This highlights a critical emerging issue in process adherence, further supported by high repetition counts in states N (1777), A (1990), and W (1653) suggesting process inefficiencies or data recording inconsistencies."
151,1,"The incident management process exhibits significant non-compliance, particularly from the Responder's perspective on individual activity performance. The 'activation' (0.1) and 'awaiting' (0.14) activities fall below the acceptable fitness threshold of 0.15, indicating poor conformance. This is corroborated by extremely high repetition counts in 'detection' (1777), 'activation' (1990), and 'awaiting' (1653), and high missing/mismatch deviations in 'detection' (319 missing) and 'activation' (544 missing, 115 mismatch). Furthermore, average times in 'detection' (4d 6h), 'activation' (8d 18h), 'awaiting' (16d 8h), and 'resolution' (5d 22h) far exceed their respective non-acceptable time thresholds (e.g., 'awaiting' is 16 days vs. 10 days non-acceptable), highlighting severe bottlenecks.

**Recommendation:**
Prioritize remediation efforts on the 'activation' and 'awaiting' activities to improve fitness scores to at least 0.15. Immediately investigate the root causes for the excessively high repetition rates across 'detection', 'activation', and 'awaiting', as well as high missing and mismatch deviations, as these are critical impediments to compliance. Implement process optimizations to drastically reduce the average time spent in 'detection', 'activation', 'awaiting', and 'resolution' phases."
151,2,"The 'activation' (A) and 'awaiting' (W) activities are non-compliant, with fitness scores of 0.1 and 0.14 respectively, both below the acceptable threshold of >= 0.15. The low compliance for 'activation' is due to high repetitions (1990), missing steps (544), and mismatches (115). 'Awaiting' also exhibits significant repetitions (1653). To remediate, standardize procedures for 'activation' to reduce deviations across all types, and streamline the 'awaiting' phase to minimize repetitions, ensuring adherence to the reference model."
151,3,"The ""activation"" (A) activity has a critical compliance issue with an average fitness of 0.1, falling below the acceptable threshold of 0.15. This is largely due to high repetition (1990) and missing (544) deviations, and its average duration (8d, 18h, 55min) exceeds the non-acceptable limit (5 days). Similarly, the ""awaiting"" (W) activity is critical with an average fitness of 0.14, below the 0.15 threshold, stemming from very high repetition deviations (1653) and an average duration (16d, 8h, 10min) significantly past the non-acceptable limit (10 days).

**Remediation:** For ""activation"", responders must streamline procedures to reduce repetitions and ensure all steps are completed, actively investigating and resolving underlying causes for these deviations and delays. For ""awaiting"", implement stricter exit criteria and improve coordination with external dependencies or other teams to prevent incidents from repeatedly returning to this state and reduce the excessive time spent."
