control_id,iteration,recommendation
148,1,"The incident management process currently exhibits a **low non-compliance cost of 0.0474**, falling within acceptable limits according to the revised thresholds. However, the **SLA attainment rate remains critically low at 44.43%**, indicating a significant failure to meet contractual obligations. While active incidents decreased positively from 1963 to 451 and 1598 incidents were closed (predominantly low severity with 103 high and 7 critical), the reported opening of only 5 new incidents in the period seems incongruous and requires investigation into data accuracy. Immediate remediation is required to improve SLA adherence, and the discrepancy in newly opened incident counts must be addressed."
148,2,"The incident management process demonstrates high compliance with an average non-compliance cost of 0.047, categorized as low severity. While active incidents significantly decreased from 1963 to 451, and only 6.88% of the 1598 closed incidents were high or critical, a critical concern is the low SLA adherence of 44.43%. Remediation must prioritize investigating and reducing the exceptionally high average resolution time of 21807.82 minutes to ensure contractual obligations are met."
148,3,"The incident management process demonstrates a **low non-compliance cost of 0.0474**, which falls within acceptable limits for a manager's overview. Active incidents were significantly reduced from 1963 to 451, with a total of 1598 incidents closed (including 103 high and 7 critical severity incidents). However, a critical issue remains the consistently low SLA adherence of only **44.43%**, directly impacting contractual obligations. A remediation is required to investigate the root causes of the lengthy average resolution time (approximately 15 days) to improve SLA performance, potentially by examining the process for incidents where the assigned and resolving personnel differ (0.0% alignment)."
148,4,"Incident management demonstrated positive progress with active incidents decreasing from 1963 to 451, and 1598 incidents successfully closed within the period. The overall average process compliance cost is low at 0.0474, which is within acceptable thresholds and classified as low severity, with only 6.88% (110 incidents) incurring high or critical compliance costs, especially considering the tunings for specific deviation types. However, SLA adherence remains critically low at 44.43%, and the average time to resolve incidents is a lengthy 15.14 days. Immediate remediation is required to improve operational efficiency to meet contractual SLA obligations and reduce the average resolution time."
148,5,"The overall process non-compliance cost is low at 0.0474, indicating strong process adherence after accounting for acceptable deviations like repetitive detections (1777 instances), N*RC variants (544 missing activations), and repetitive awaiting activities (1653 instances). Operationally, active incidents significantly decreased from 1963 to 451, with 1598 incidents closed during the period, predominantly with low severity (1398). However, a critical issue remains as only 44.43% of incidents met their Service Level Agreements, representing a significant breach of contractual obligations. Remediation must prioritize investigating and improving SLA adherence, irrespective of the strong process compliance in terms of cost."
148,6,"The incident management process shows a significant improvement in overall compliance, reflected by a low non-compliance cost of 0.047, placing it in the 'low' severity range for cost. Despite this, adherence to Service Level Agreements remains critically low at 44.43%, indicating a persistent failure to meet contractual obligations. While active incidents decreased substantially from 1963 to 451, the average time to resolve incidents is still high at 15.14 days. Remediation should prioritize improving SLA adherence and investigating the underlying reasons for the prolonged average resolution time."
148,7,"For the selected period, active incidents decreased significantly from 1963 to 451, with 1598 incidents closed, largely low severity (1398). Although the overall process non-compliance cost is low at 0.0474, indicating strong adherence to defined process steps (considering specific deviation exclusions), only 44.43% of incidents met their SLA. This poor SLA performance is primarily driven by an exceptionally high average resolution time of approximately 15.14 days (21807.82 minutes). Remediation should prioritize identifying and addressing specific bottlenecks causing these prolonged resolution times to ensure contractual obligations are met."
148,8,"The incident management process shows a commendably low overall compliance cost of 0.0474, indicating strong adherence to process steps when accounting for acceptable deviations like repetitive detection/awaiting activities and N->R->C merge scenarios. However, critical operational performance metrics for the period are unsatisfactory, with only 44.43% of SLAs met and an average resolution time of over 15 days (21807.82 minutes). Furthermore, a 0% rate for assigned-to-resolved-by suggests severe issues with incident ownership and handoffs. Remediation must prioritize improving SLA attainment and resolution times, alongside an urgent review of incident ownership practices and clarification of the discrepancy between 5 new and 1598 closed incidents in the period."
148,9,"The overall incident management process compliance, measured by non-compliance cost, is excellent at 0.0474, categorized as 'low' severity. The number of active incidents has shown a positive trend, decreasing significantly from 1963 to 451 within the reporting period, and only 6.88% of closed incidents were of high or critical severity. However, a critical concern is the consistently low SLA adherence rate of 44.43%, indicating that over half of all incidents are not meeting contractual obligations, coupled with a high average resolution time of 15.14 days. Remediation must focus on identifying and addressing the root causes of these prolonged resolution times to significantly improve SLA compliance across all incidents."
148,10,"The incident management process demonstrates a **low non-compliance cost of 0.0474**, indicating high adherence to the reference model, with repetitive detection and awaiting deviations falling within newly acceptable thresholds. Despite this strong process compliance, only **44.43% of SLAs were met**, severely impacted by a **very high average time to resolve incidents of 21807.82 minutes (~15.14 days)**. Active incidents were significantly reduced from 1963 to 451, and 1598 incidents were closed (including 7 critical, 103 high, and 90 moderate severity) during the period. Remediation must prioritize strategic initiatives to drastically reduce the average time to resolve incidents, thereby improving critical SLA adherence and meeting contractual obligations."
149,1,"While the updated context clarifies that repetitive 'Detection' (1777), repetitive 'Awaiting' (1653), and ""N*RC"" variants are not considered process errors, significant non-compliance persists. Average durations for 'Activation' (8d, 18h, 55min), 'Awaiting' (16d, 8h, 10min), and 'Resolution' (5d, 22h, 11min) critically exceed non-acceptable thresholds. Furthermore, 'Activation' shows excessive repetitions (1990 vs. <=500) and mismatches (115 vs. <=50), while 'Resolution' also exceeds acceptable limits for repetitions (119 vs. <=50) and mismatches (45 vs. <=20).

**Required Remediation:**
Investigate the root causes for the critically extended average durations in 'Activation', 'Awaiting', and 'Resolution' states. Address the high frequency of repetitions and mismatches in 'Activation' and 'Resolution', and examine the 319 missing 'Detection' and 544 missing 'Activation' activities to ensure proper process initiation and logging."
149,2,"The incident management process exhibits significant non-compliance, despite the re-interpretation of 'detection' and 'awaiting' repetitions and acceptance of `N*RC` variants. Critical issues persist with most states exceeding non-acceptable average durations: 'detection' (4d 6h 35min), 'activation' (8d 18h 55min), 'awaiting' (16d 8h 10min), and 'resolution' (5d 22h 11min). Furthermore, 544 missing 'activation' activities, 1990 repetitive 'activation' activities, and an unauthorized 'detection' to 'awaiting' transition (avg 1d 0h 45min) highlight serious process execution flaws. Remediation is required to enforce sequential process adherence, particularly preventing direct 'detection' to 'awaiting' transitions, and to investigate the root causes of prolonged state durations and high deviation counts for 'activation' and 'resolution' activities."
149,3,"Despite specific exemptions for 'detection' (1777 repetitions) and 'awaiting' (1653 repetitions) activities, as well as the 'N R C' variant, the incident management process exhibits significant compliance issues. Critical deviations include frequent missing 'detection' (319 occurrences vs. <=20 acceptable) and 'activation' (544 occurrences vs. <=200 acceptable) states. Furthermore, the process shows excessive repetitive 'activation' (1990 occurrences vs. <=500 acceptable) and 'resolution' (119 occurrences vs. <=50 acceptable), along with 'mismatch' deviations in 'activation' (115 vs. <=50 acceptable) and 'resolution' (45 vs. <=20 acceptable). Operationally, the average 'awaiting' state duration of 16 days far exceeds the 10-day non-acceptable threshold, posing a major bottleneck.

**Required Remediation:**
Investigate and remediate the root causes for the high number of missing 'detection' and 'activation' states. Address the significant repetition and mismatch deviations within the 'activation' and 'resolution' phases by enforcing process adherence or clarifying acceptable variances. Collaborate with external stakeholders to reduce the excessive average duration of the 'awaiting' state, despite its external dependency, as it critically impacts overall incident resolution times."
149,4,"Despite the adjusted interpretation for repetitive detection (1777 occurrences) and awaiting activities (1653 occurrences), and the acceptance of 'N*RC' variants, the incident management process continues to exhibit a critical level of non-compliance based on the cost metric. Average state durations remain critically high for 'detection' (4d 6h 35min), 'activation' (8d 18h 55min), 'awaiting' (16d 8h 10min), and 'resolution' (5d 22h 11min), all significantly exceeding non-acceptable thresholds. Critical process deviations persist with high 'missing' in detection (319) and activation (544), alongside significant 'repetition' (1990) and 'mismatch' (115) in activation, and 'repetition' (119) and 'mismatch' (45) in resolution, all far surpassing acceptable limits.

**Required Remediation:** Immediately investigate and rectify the root causes for these persistent prolonged state durations and critical deviations, particularly focusing on 'detection', 'activation', and 'resolution' to enforce process adherence and improve operational efficiency."
149,5,"The incident management process shows moderate compliance with significant performance issues. While recent clarifications mitigate concerns around repetitive detection (N) and awaiting (W) activities, and the N*RC variant (due to merge rules), critical bottlenecks persist in core process states.

Average durations for Detection (4d 6h 35min), Activation (8d 18h 55min), Awaiting (16d 8h 10min), and Resolution (5d 22h 11min) all critically exceed non-acceptable thresholds (e.g., Detection non-acceptable >= 2880 min, Activation >= 7200 min, Awaiting >= 14400 min, Resolution >= 4320 min), leading to a high non-compliance cost. Furthermore, a high number of mismatch deviations in Activation (115 vs. <=50 acceptable) and Resolution (45 vs. <=20 acceptable) indicate non-standard transitions and process bypasses, contributing significantly to non-compliance cost and overall process inefficiency.

**Recommendation & Remediation:**
Focus remediation efforts on reducing the excessive time spent in Detection, Activation, Awaiting, and Resolution states, as these are the primary drivers of non-compliance cost. Investigate the root causes of mismatches in Activation and Resolution to identify why non-standard process flows are occurring so frequently, ensuring operators adhere to defined procedures for these critical phases."
149,6,"The incident management process exhibits critical non-compliance, with a calculated cost of 140.04, significantly exceeding the critical threshold of `<=2.0`. Key deviations include missing 'detection' (N: 319) and 'activation' (A: 544) activities, alongside excessive repetitions in 'activation' (A: 1990) and 'resolution' (R: 119), and mismatches in 'activation' (A: 115) and 'resolution' (R: 45), all critically surpassing acceptable thresholds. Furthermore, average durations for 'detection' (4d, 6h), 'activation' (8d, 18h), 'awaiting' (16d, 8h), and 'resolution' (5d, 22h) are critically prolonged, indicating severe bottlenecks. Urgent remediation is required to address these critical deviations and drastically improve processing times within core incident states."
149,7,"The re-evaluation reveals that while 'Detection' repetitions (1777), 'Awaiting' repetitions (1653), and the frequent 'N R C' variant (182 occurrences) are now deemed acceptable due to updated thresholds and process explanations, significant compliance concerns persist. Average durations for 'Detection' (4d 6h 35min), 'Activation' (8d 18h 55min), 'Awaiting' (16d 8h 10min), and 'Resolution' (5d 22h 11min) remain critically high, severely exceeding non-acceptable thresholds and indicating systemic bottlenecks. Furthermore, critical deviations exist for missing 'Detection' (319) and 'Activation' (544), and excessive repetitions/mismatches in 'Activation' (1990 repetition, 115 mismatch), 'Resolution' (119 repetition, 45 mismatch), and 'Closure' (8 repetition). These remaining deviations significantly contribute to non-compliance costs, warranting immediate attention.

**Required Remediation:**
Urgently address the critically high average durations in the Detection, Activation, Awaiting, and Resolution states by identifying and resolving underlying bottlenecks. Investigate the root causes of the high counts of missing 'Detection' and 'Activation' activities, as well as the excessive repetitions and mismatches observed in 'Activation', 'Resolution', and 'Closure' states."
149,8,"The incident management process shows an overall critical compliance cost, despite recent adjustments. While repetitive detection (N) and awaiting (W) activities are now deemed non-process errors due to tuned thresholds (1777 actual N repetition vs. <=5000, and 1653 actual W repetition vs. <=2000), other critical deviations remain. Specifically, missing activation (A) events (544 occurrences) and excessive repetitions in Activation (A, 1990 vs. <=500), Resolution (R, 119 vs. <=50), and Closure (C, 8 vs. <=5) activities contribute significantly to non-compliance costs. Furthermore, average state durations, especially for Awaiting (W) at 16 days, 8 hours, and 10 minutes, far exceed the non-acceptable threshold of 14400 minutes (10 days).

The instruction regarding ""N*RC"" variants (Detection-Resolution-Closure) indicates they should not be considered errors due to merge rules. However, the current data does not allow for a precise calculation of how many of the 'missing A' or 'mismatch' deviations are solely attributable to these excused N*RC flows versus actual process non-compliance. Therefore, a complete recalculation of the compliance cost, with these specific exclusions, is not feasible with the given granular data.

**Recommendation:**
The incident management process exhibits critical non-compliance, with a calculated cost of approximately 140.9, far exceeding the critical threshold of 0.3. Remediation is required to reduce actual process deviations, particularly the high count of missing Activation (A) activities (544) and repetitions in Activation (A, 1990), Resolution (R, 119), and Closure (C, 8) that still exceed acceptable thresholds. Additionally, the excessively long average duration in the Awaiting (W) state (16d, 8h, 10min) must be addressed as it significantly impacts overall process efficiency. Implement improved data granularity for deviations to differentiate between excused system-driven variants (like N*RC flows) and actual operator non-compliance."
149,9,"The incident management process exhibits significant compliance issues with critical inefficiencies. Average state durations for `detection` (6155 min), `activation` (12655 min), `awaiting` (23530 min), and `resolution` (8531 min) all substantially exceed non-acceptable thresholds. While repetitive `detection` (1777) and `awaiting` (1653) deviations are within tuned acceptable limits, high counts for `missing detection` (319), `missing activation` (544), `repetitive activation` (1990), and `mismatch activation` (115) persist. Despite the exemption for `N*RC` variants, the provided data is insufficient to precisely quantify their impact on the reported `missing` and `mismatch activation` figures. Remediation is required to address the pervasive excessive state durations and investigate the root causes of the remaining non-compliant activity deviations."
149,10,"As a Monitor, the incident management process continues to exhibit critical compliance issues despite the updated configuration. Average state durations for 'detection' (6155 min), 'activation' (12655 min), 'awaiting' (23530 min), and 'resolution' (8531 min) significantly exceed their respective non-acceptable thresholds, indicating severe process bottlenecks. While repetitive 'detection' and 'awaiting' activities and 'N*RC' variants are now exempt, high counts of 'missing' deviations for 'detection' (319) and 'activation' (544), along with 'repetition' for 'activation' (1990), 'resolution' (119), 'closure' (8), and 'mismatch' for 'activation' (115) and 'resolution' (45) still represent significant process non-compliance against defined thresholds. Furthermore, the direct transition from 'detection' to 'awaiting' (N->W), observed with an average time of ""1d, 0h, 45min"", remains an unauthorized model deviation requiring attention."
150,1,"The most frequent variants, such as 'N R C' (182 incidents), 'A R C' (135 incidents), and 'N N R C' (81 incidents), are largely compliant given the updated understanding that N\*RC flows are due to merge rules, and repetitive 'N' and 'W' activities are within acceptable thresholds (1777 and 1653 respectively). However, significant non-compliance is evident in other areas, with 'missing detection' events at 319 occurrences (acceptable `<=20`) and 'missing activation' events at 544 occurrences (acceptable `<=200`). Additionally, 'mismatch activation' (115 vs. `<=50`) and 'mismatch resolution' (45 vs. `<=20`) indicate substantial process adherence issues. Remediation should focus on investigating the root causes for these high counts of missing and mismatched states, which represent critical failures in process execution."
150,2,"The most frequent recorded variant `N R C` (182 incidents), along with patterns like `N N R C` (81 incidents), are not process non-compliance concerns for the Monitor, as they are attributed to automated merging rules and repetitive detection triggers. However, the `A R C` variant (135 incidents) is a significant deviation, indicating incidents bypassing the initial 'detection' state, which incurs a high non-compliance cost. Furthermore, repeated 'activation' steps, as seen in `N A A R C` (46 incidents), remain a process compliance issue, suggesting potential rework or re-evaluation. Remediation is required to investigate the root causes for bypassing the 'detection' state and the frequent repetition of 'activation' activities."
150,3,"The most frequent recorded variants include several paths now deemed compliant due to updated interpretations: ""N R C"" (182 occurrences), ""N N R C"" (81 occurrences), and ""N A R C"" (59 occurrences) represent valid or automated process flows, with repetitive detections now excused. However, significant non-compliance patterns persist, such as ""A R C"" (135 occurrences) which frequently bypasses the initial detection stage, and variants with unexcused repetitive 'activation' like ""N A A R C"" (46 occurrences) and ""A A R C"" (38 occurrences). Critically, ""R C"" (27 occurrences) entirely omits initial stages, and ""N W R C"" (22 occurrences) represents an invalid transition from detection to awaiting. Required remediation: Investigate the root causes for missing detection, unexcused repetitive activation, direct resolution initiation, and invalid state transitions (N->W) to ensure adherence to the defined incident management process."
150,4,"The most frequent recorded variants are 'N R C' (182 incidents), 'A R C' (135 incidents), and 'N N R C' (81 incidents). Variants like 'N R C', 'N N R C', and 'N N N R C' (49 incidents) are compliant, reflecting automated merge rules where new triggers integrate into a leading case without manual 'Activation' or 'Awaiting', and repetitive 'Detection' indicates multiple technical triggers, not process errors. However, 'A R C' (135 incidents) and 'A A R C' (38 incidents) indicate non-compliance by skipping the initial 'Detection' state, while 'N A A R C' (46 incidents) highlights unexcused repetitive 'Activation' activities.

**Recommendation:** Investigate the underlying reasons for incidents bypassing the 'Detection' phase (e.g., 'A R C') and for recurring 'Activation' activities (e.g., 'N A A R C'), as these indicate deviations from defined process flows not covered by the current compliance exceptions."
150,5,"The most frequent variants are 'N R C' (182 incidents), 'A R C' (135 incidents), and 'N N R C' (81 incidents). The 'N R C' pattern, including repetitions in 'detection' (N), is now considered acceptable due to temporary merge rules and multiple detection triggers. However, the Monitor should investigate variants with repetitive 'Activation' (A) such as 'N A A R C' (46 incidents) and 'A A R C' (38 incidents), as these incur a 'repetition' cost of 0.2 per 'A' event. Furthermore, the 'R C' variant (27 incidents) indicates incidents bypassing 'Detection' and 'Activation' entirely, leading to significant 'missing' costs for 'N' (0.2) and 'A' (0.05), which requires attention.

**Required Remediation:**
Investigate the underlying reasons for repetitive 'Activation' activities to optimize the process and reduce associated non-compliance costs. Additionally, analyze incidents following the 'R C' variant to understand why initial 'Detection' and 'Activation' states are consistently missed, addressing potential blind spots in incident logging or initial processing."
150,6,"The most frequent *truly non-compliant* variants are 'A R C' (135 occurrences) and 'N A A R C' (46 occurrences). 'A R C' indicates a frequent skip of the crucial 'detection' (N) phase, which aligns with 319 total missing 'N' events, incurring a high non-compliance cost. 'N A A R C' highlights a concerning pattern of excessive repetitions in the 'activation' (A) state, with 1990 recorded repetitions significantly exceeding the acceptable threshold of 500. While 'N R C' (182 occurrences) and other 'N*RC' variants, along with 'N' and 'W' repetitions, are excused by new interpretations, these issues of 'missing N' and 'A' state repetitions demand immediate remediation to improve incident management compliance."
150,7,"The most frequent recorded variants are 'N R C' (182 incidents) and 'A R C' (135 incidents). Based on the updated environment variables, `N*RC` variants like 'N R C', 'N N R C' (81 incidents), and repetitive 'detection' activities are considered compliant due to merge rules and acceptable technical triggers. However, 'A R C' (135 incidents) is non-compliant as it bypasses the mandatory 'detection' state, incurring a low compliance cost of 0.08. Other critical non-compliant patterns include repetitive 'activation' activities (e.g., 'N A A R C' - 46 incidents, cost 0.04) and the unauthorized 'N W R C' (22 incidents) transition, which bypasses 'activation' (cost 0.02).

**Recommendation:** As a Monitor, investigate the root causes for incidents bypassing the initial 'detection' phase (e.g., 'A R C', 'R C' variants) and the frequent repetitions within the 'activation' process."
150,8,"The most frequent recorded variants are 'N R C' (182 incidents), 'A R C' (135 incidents), and 'N N R C' (81 incidents). While 'N R C' and 'N N R C' are now considered compliant due to automatic merge rules for incidents with new triggers and the nature of repetitive detections, the 'A R C' variant still indicates a deviation. As a Monitor, it is recommended to investigate why 135 incidents initiate directly at 'Activation' ('A'), bypassing the mandatory 'Detection' ('N') state, as this suggests a gap in the initial incident capture or logging process that requires remediation."
