control_id,iteration,recommendation
151,4,"The 'Activation' phase shows critical non-compliance with a fitness of 0.1 (below the >=0.15 threshold) and excessive deviations in missing (544 vs. <=200), repetition (1990 vs. <=500), and mismatch (115 vs. <=50). Additionally, 'Detection' has critically high missing (319 vs. <=20) and repetition (1777 vs. <=500) deviations, and 'Awaiting' has critically high repetition (1653 vs. <=200) deviations with slightly below acceptable fitness (0.14 vs. >=0.15). 'Resolution' also suffers from high repetition (119 vs. <=50) and mismatch (45 vs. <=20) deviations.

**Required Remediation:**
Immediate process clarification and mandatory retraining for responders are needed for the 'Activation' phase. Further investigation into the root causes of high missing and repetition deviations in 'Detection' and 'Awaiting', as well as high repetition and mismatch in 'Resolution', is crucial to streamline workflows and enforce compliance with the reference model."
151,5,"The incident management process exhibits critically low fitness, with all activity averages (0.10 to 0.17) falling into the overall ""critical"" severity range. Specifically, ""Activation"" (0.10) and ""Awaiting"" (0.14) activities fall below their acceptable fitness thresholds (>=0.15), primarily due to extensive repetitions (1990 in Activation, 1653 in Awaiting) and significant missing steps (544 in Activation, 319 in Detection). Furthermore, all activities except ""Closure"" demonstrate critically high average durations, dramatically exceeding non-acceptable time limits (e.g., ""Awaiting"" takes 16d 8h 10min compared to the non-acceptable threshold of >=10 days). Remediation requires an urgent, comprehensive process review to identify root causes for these deviations, implement targeted automation for repetitive tasks, and provide focused training to improve adherence and reduce delays in ""Detection"", ""Activation"", ""Awaiting"", and ""Resolution""."
151,6,"The 'Activation' (0.10 fitness) and 'Awaiting' (0.14 fitness) activities show critically low average fitness, falling below the acceptable compliance threshold of >=0.15. This non-compliance is primarily driven by a high number of 'repetition' deviations (1990 in Activation, 1653 in Awaiting). Additionally, 'Activation' also exhibits a significant number of 'missing' deviations (544).

**Recommendation:** The Responder must prioritize investigating the root causes of these excessive repetitions and missing steps in the 'Activation' and 'Awaiting' phases. Remediation efforts should focus on process streamlining and enforcement to ensure consistent execution, thereby improving overall compliance."
151,7,"All assessed process activities currently exhibit ""critical"" average fitness (ranging from 0.10 to 0.17), indicating a widespread systemic issue with process conformance. Specifically, the 'Activation' (0.10) and 'Awaiting' (0.14) activities fall below their minimum acceptable average fitness of 0.15. Additionally, significant non-compliance exists due to excessive deviations: 'Detection' has 319 missing and 1777 repetition deviations (exceeding <=20 and <=500 respectively); 'Activation' shows 544 missing, 1990 repetition, and 115 mismatch deviations (exceeding <=200, <=500, and <=50); 'Awaiting' has 1653 repetition deviations (exceeding <=200); and 'Resolution' reports 119 repetition and 45 mismatch deviations (exceeding <=50 and <=20).

**Recommendation:** Urgent remediation is required for the 'Activation' activity, which fails on both average fitness and all deviation types. Furthermore, intensive process enforcement and training must be implemented for 'Detection', 'Awaiting', and 'Resolution' to address the high volume of missing, repetition, and mismatch deviations, aiming to significantly improve adherence to the reference model."
151,8,"Overall incident management compliance is poor, with key activities exhibiting critical non-compliance. Specifically, 'Activation' (0.1) and 'Awaiting' (0.14) fall below the acceptable fitness threshold of >=0.15. Furthermore, 'Detection', 'Activation', 'Awaiting', and 'Resolution' show critically high deviations in missing, repetition, and/or mismatch categories (e.g., 'Activation' has 544 missing, 1990 repetitions, 115 mismatches) and alarmingly long average durations significantly exceeding acceptable limits (e.g., 'Activation' averaging 12655 min vs. <=4320 min acceptable).

**Required Remediation:**
A thorough investigation into the root causes of these high deviations and prolonged durations in 'Detection', 'Activation', 'Awaiting', and 'Resolution' is immediately required. This likely necessitates process re-engineering for these activities, including re-evaluating workflows, improving training, and optimizing resource allocation to ensure adherence to defined process steps and target completion times."
151,9,"Incident management compliance for recorded IT security incidents is low. Average fitness for 'Activation' (0.1) and 'Awaiting' (0.14) are below their acceptable threshold of 0.15. Significant deviations, including high 'missing' and 'repetition' counts in 'Detection' (319, 1777), 'Activation' (544, 1990), 'Awaiting' (1653 repetition), and 'Resolution' (119 repetition, 45 mismatch) severely impede process conformance across nearly all activities. Remediation is required to identify and address the root causes of these deviations to improve adherence to the defined incident management model."
151,10,"The average fitness compliance for the ""Activation"" (0.1) and ""Awaiting"" (0.14) activities is critically below the acceptable threshold of `>= 0.15`. For ""Activation"", all deviation types (missing: 544, repetition: 1990, mismatch: 115) far exceed their acceptable limits (200, 500, 50 respectively), and the average time (8d 18h 55min) is well above the non-acceptable threshold (5 days). For ""Awaiting"", repetition deviations (1653) are significantly over the acceptable limit (200), and the average time (16d 8h 10min) is critically high, exceeding the non-acceptable threshold (10 days).
**Recommendation:**
Focus immediate remediation efforts on the ""Activation"" and ""Awaiting"" phases. Implement stricter controls or automated checks to reduce missing, repetition, and mismatch deviations in ""Activation"". For ""Awaiting"", prioritize reducing repetitions and investigate the causes of excessive delays to bring average times down within acceptable limits for both activities."
152,1,"The average durations for Detection (4d 6h 35min), Activation (8d 18h 55min), Awaiting (16d 8h 10min), and Resolution (5d 22h 11min) critically exceed their respective non-acceptable time thresholds (2880 min, 7200 min, 14400 min, 4320 min). These extended durations indicate severe process efficiency impediments.

**Recommendation:**
Prioritize an immediate investigation into the root causes of these prolonged durations for Detection, Activation, Awaiting, and Resolution activities. Focus on analyzing contributing factors such as the high frequency of repetitions (e.g., Activation: 1990, Detection: 1777, Awaiting: 1653) and missing events (e.g., Detection: 319, Activation: 544) to identify bottlenecks and streamline workflows for future reduction."
152,2,"All activities except closure significantly impede process efficiency, with average durations well beyond their 'nonAcceptableTime' thresholds. Specifically, 'detection' (6155 min vs. non-acceptable 2880 min), 'activation' (12655 min vs. 7200 min), 'awaiting' (23530 min vs. 14400 min), and 'resolution' (8531 min vs. 4320 min) indicate critical bottlenecks. The 'awaiting' state is the most severe, averaging over 16 days. Remediation requires prioritizing improvements in initial incident triage for 'activation', optimizing resource allocation to minimize 'awaiting' times, and enhancing tools/training to expedite 'detection' and 'resolution' processes."
152,3,"The assessment reveals significant efficiency impediments in most incident management activities based on average durations. The ""awaiting"" state averages 16 days, 8 hours, 10 minutes (23530 minutes), far exceeding its non-acceptable threshold of 14400 minutes. Similarly, ""activation"" (8 days, 18 hours, 55 minutes or 12655 minutes), ""resolution"" (5 days, 22 hours, 11 minutes or 8531 minutes), and ""detection"" (4 days, 6 hours, 35 minutes or 6155 minutes) are all well above their respective non-acceptable thresholds (7200, 4320, and 2880 minutes). Only ""closure"" (0 days, 0 hours, 40 minutes) is within the acceptable time of 720 minutes.

**Recommendation and Remediation:**
Focus immediate remediation on streamlining the ""awaiting,"" ""activation,"" ""resolution,"" and ""detection"" phases. This should involve reviewing handoff procedures, resource allocation, and potential automation opportunities to significantly reduce these non-compliant average durations."
152,4,"The average activity durations indicate significant process inefficiency, with detection (N: 4d 6h 35min), activation (A: 8d 18h 55min), awaiting (W: 16d 8h 10min), and resolution (R: 5d 22h 11min) all greatly exceeding their acceptable and non-acceptable time thresholds. The ""awaiting"" (W) state, in particular, is a critical bottleneck, surpassing its 5-day acceptable limit by over 11 days.

**Recommendation:** Investigate and identify the root causes for the excessively long durations in the detection, activation, awaiting, and resolution phases.

**Required Remediation:** Implement measures to streamline these activities, focusing particularly on reducing time spent in the 'awaiting' state (e.g., through improved communication, resource allocation, or process automation)."
152,5,"The ""awaiting"" (W) activity severely impedes process efficiency with an average duration of 16 days, 8 hours, 10 minutes, which is well above the non-acceptable threshold of 10 days (14400 minutes). This prolonged duration is significantly influenced by a high number of repetitions in this state (1653 instances). For future reduction in activity durations, investigate the root causes of incidents frequently returning to or remaining in the ""awaiting"" state."
152,6,"The average durations for Detection (4d 6h 35min), Activation (8d 18h 55min), Awaiting (16d 8h 10min), and Resolution (5d 22h 11min) significantly exceed their respective non-acceptable time thresholds. The 'Awaiting' activity shows the longest average duration, strongly impeding overall process efficiency. Remediation requires immediate investigation into the root causes for these prolonged durations, particularly for 'Awaiting' and 'Activation' states, to identify opportunities for process streamlining, automation, or improved resource allocation. The 'Closure' activity is the only one performing within acceptable limits."
152,7,"The average durations for Detection (N: 4d 6h 35min), Activation (A: 8d 18h 55min), Awaiting (W: 16d 8h 10min), and Resolution (R: 5d 22h 11min) severely impede process efficiency, as they significantly exceed their non-acceptable thresholds (N: >= 2880 min, A: >= 7200 min, W: >= 14400 min, R: >= 4320 min). Remediation is required to reduce these durations, particularly by investigating the high number of repetitions (e.g., Activation: 1990, Awaiting: 1653) and mismatches (e.g., Activation: 115) contributing to critically low compliance (all < 0.18). Focus on streamlining workflows, automating repetitive tasks, and improving clarity in state transitions within these activities."
152,8,"The ""Awaiting"" activity is the most significant impediment to efficiency, averaging 16 days, which is far beyond the non-acceptable threshold of 14400 minutes. This is largely driven by an exceptionally high number of repetitions (1653 events), considerably exceeding the acceptable limit of 200. Similarly, ""Activation"" (8 days, 1990 repetitions) and ""Resolution"" (5 days, 119 repetitions) also exhibit critical durations and high repetition deviations. Remediation efforts should prioritize a root cause analysis for these excessive repetitions and implement process improvements or automation to reduce delays and re-work in these key stages."
152,9,"The average durations for Detection (6155 min), Activation (12655 min), Awaiting (23530 min), and Resolution (8531 min) are critically high, significantly exceeding their respective non-acceptable thresholds. The ""Awaiting"" state is the longest bottleneck, also showing critically high repetitions (1653 vs. <=200 acceptable), while the ""Activation"" state exhibits critically high missing, repetition, and mismatch deviations, directly impeding efficiency. Remediation is required to optimize these activities by reducing repetitions and other deviations to bring durations below the non-acceptable thresholds, as only the Closure activity (40 min) operates within acceptable limits."
152,10,"The average durations for Detection (6155 min), Activation (12655 min), Awaiting (23530 min), and Resolution (8531 min) are critically high, significantly exceeding their respective non-acceptable time thresholds. The 'Awaiting' state represents the most severe bottleneck, indicating substantial delays in incident progression. These prolonged durations impede process efficiency and correlate with critically low process fitness values (0.10-0.17) across most activities. To reduce future activity durations, responders should investigate the root causes of these delays, especially within the 'Awaiting' state, and implement targeted process improvements or resource re-allocation."
153,1,"All 370 incidents provided exhibit critical non-compliance, with fitness scores ranging from 0.19 to 0.5. The majority of these critical incidents consistently show `Impact=2`, `Urgency=2`, and `Priority=3`, indicating that even medium-severity incidents are poorly managed. This widespread process drift poses a significant risk of inefficient resolution, prolonged security exposures, and operational instability. Remediation requires an in-depth analysis of actual activity traces for incidents associated with the prevalent `Symptom 491` and common `Locations 204, 143, 161`, as well as `Categories 46, 26, 42, 53, 23, 57, 9` to pinpoint exact process deviations."
153,2,"All 498 analyzed incidents exhibit critical non-compliance, with fitness scores ranging from 0.19 to 0.50, indicating a systemic failure to adhere to the defined process. The majority of these incidents are consistently classified with Impact 2, Urgency 2, and Priority 3, yet show severe process deviations, suggesting a mismatch in classification or execution. This widespread non-compliance risks operational inefficiency, loss of control, and potential security gaps for moderately critical issues. Remediation requires a deep dive into specific activity deviations for common patterns like Symptom 491, Location 204, and Category 46, to either enforce process adherence through targeted training or re-evaluate the reference model for these incident types."
153,3,"The most critical non-compliant incidents, such as INC0032450 (fitness 0.190) and INC0025501 (fitness 0.207), all fall into the 'critical' compliance severity level (fitness <= 0.5), indicating significant deviations from the defined process. This non-compliance presents risks of delayed resolution, incorrect incident handling, and potential security gaps due to a substantial drift between the theoretical and practical process. To deep dive into root causes and propose targeted remediations, data on the actual process traces or state transitions for these specific critical incidents is required, as the current technical attribute data does not show specific process deviations."
153,4,"All listed incidents exhibit critical non-compliance, with fitness scores ranging from 0.19 (INC0032450) to 0.5, indicating severe deviations from the defined process model across a large number of incidents. The majority of these critically non-compliant incidents share common attributes: Impact 2, Urgency 2, and Priority 3, suggesting a systemic breakdown in handling standard or moderately severe incidents. This pervasive non-compliance poses a significant risk of inconsistent incident resolution and potential security vulnerabilities. A deep dive into the specific process traces of the lowest fitness incidents (e.g., INC0032450) is required to identify exact deviations and address systemic weaknesses, including investigating the frequent 'None' values for symptoms."
153,5,"All incidents listed in ""most_critical_incidents"" (e.g., INC0032450 with a fitness of 0.19) fall into the 'critical' compliance category (fitness <= 0.5), indicating severe deviations from the defined incident management process. This non-compliance risks unpredictable incident handling, delayed resolution of security issues, and increased operational vulnerabilities.

To address this, initiate a detailed root cause analysis focusing on incidents with missing symptom data (109 occurrences of 'None' symptom) to understand gaps in initial incident recording. Further investigate the process flows for incidents characterized by Symptom 491, Location 204, and Category 46, as these are the most frequent attributes among the non-compliant incidents, to identify specific points of deviation from the reference model."
153,6,"All provided incidents are critically non-compliant with fitness values ranging from 0.19 to 0.5, indicating severe deviations from the defined incident management process. This poses significant risks of inefficient handling, prolonged resolution, and potentially higher business impact, as evidenced by some incidents also having the highest technical priority (Impact=1, Urgency=1, Priority=1). A deep dive into activity specifics and process drift for these incidents is required, focusing on common attributes like Symptom 491, Locations 204, 161, 143, 93, and Categories 46, 34, 42 to identify root causes. Remediation should include process adjustments or targeted training for the identified areas to improve compliance."
153,7,"All 470+ incidents recorded between 2016-06-01 and 2016-07-01 exhibit critical non-compliance with a fitness score of 0.5 or less, with INC0032450 being the least compliant at 0.19. The pervasive non-compliance across these incidents, especially those frequently classified with Impact 2, Urgency 2, Priority 3, and specific Symptoms (e.g., 491, None), Locations (e.g., 204, 161, 143), and Categories (e.g., 46, 42, 23), poses a significant risk of inconsistent incident handling and delayed resolution. Remediation requires a deep dive into the process steps (detection, activation, awaiting, resolution, closure) for incidents sharing these common attributes to identify specific deviations and correct the drift between the theoretical and practical process, potentially through targeted training or process adjustments."
153,8,"All incidents listed (772 total) exhibit critical non-compliance, with fitness values ranging from 0.19 to 0.5. This low adherence poses significant risks, including operational inefficiencies, unpredictable incident resolution, and increased security exposure due to deviations from the defined process steps.

A deep dive into technical attributes reveals that the majority of these critically non-compliant incidents are of medium severity (Impact 2: 742, Urgency 2: 752, Priority 3: 725). Recurring hotspots for these deviations include locations 204, 143, 161, 93, and 51, and categories such as 46, 42, 53, 26, and 9.

Remediation requires focused training and process clarification for teams handling incidents with these common characteristics, specifically addressing why the defined process is not being followed in these identified locations and categories to improve compliance and mitigate risks."
153,9,"The most critical non-compliant incidents, such as INC0032450 with a fitness of 0.19, demonstrate severe deviations from the defined process, posing high operational and security risks due to unpredictable handling. A deep dive into these incidents reveals a prevalence of medium to critical priority (`impact: 2, urgency: 2, priority: 3`, or `impact: 1, urgency: 1, priority: 1`) issues, with frequently recurring attributes such as Symptom 491, Location 204, and Category 46. Remediation requires an immediate investigation into the specific process steps frequently missed or incorrectly executed for these common technical patterns, and addressing the high frequency of missing symptom data (None values) to reduce drift between theoretical and practical processes."
153,10,"As an Analyst, all 550 incidents provided are critically non-compliant, with fitness values ranging from 0.19 to 0.50, indicating significant process deviations. A deep dive into their characteristics reveals that approximately 90% are categorized with Impact 2, Urgency 2, and Priority 3, frequently originating from locations such as 204, 161, and 143. Notably, Symptom 491 is overwhelmingly prevalent in 257 incidents, while 104 incidents have no recorded symptom.

To remediate, focus investigation on process steps causing non-compliance for incidents linked to Symptom 491 and the dominant Impact/Urgency/Priority combinations. Additionally, address the lack of symptom data in 104 incidents to improve incident recording and facilitate future root cause analysis."
154,1,"As an Analyst, my focus is on identifying root causes and detailed process deviations through technical and individual incident analysis.

The technical analysis data reveals significant patterns:
*   **Most frequent symptom:** `491` appears 302 times, indicating a recurring technical issue. Additionally, ""None"" (missing symptom data) occurs 104 times, which is a major data quality issue preventing proper analysis.
*   **Most affected locations:** `204` is affected 108 times, `143` is affected 79 times, and `161` is affected 80 times, highlighting critical infrastructure points.
*   **Most affected categories:** `46` (102 times), `42` (67 times), and `26` (61 times) are the most frequent incident categories.

All incidents in the 'most_critical_incidents' view have fitness scores below 0.5 (critical compliance level), with the lowest being 0.19. This suggests a systemic failure in adhering to the incident management process, exacerbated by the lack of symptom reporting for 104 incidents.

**Recommendation:**
1.  **Mandate Symptom Reporting:** Implement a strict policy and technical controls to ensure a symptom is recorded for every incident, addressing the 104 ""None"" entries. This will improve data quality for root cause analysis.
2.  **Deep Dive into Top Offenders:** Conduct a detailed root cause analysis on incidents with symptom `491`, and those affecting locations `204`, `143`, `161`, and categories `46`, `42`, `26`, prioritizing incidents with the lowest fitness scores from the `most_critical_incidents` list (e.g., INC0032450 with fitness 0.19). This analysis should aim to identify common underlying issues and process deviations that contribute to low compliance and frequent occurrences.
3.  **Process Improvement:** Based on the deep dive, develop targeted remediation plans to address the identified root causes and process deviations. This may include updated procedures, training, or automation to improve compliance and reduce the recurrence of these specific technical issues."
154,2,"While the `technical_analysis` data provides detailed technical attributes (symptoms, locations, categories) necessary for analysis, the control ""Report Technical Analysis and most affected categories"" is not fully met as an aggregated report of these statistics is not explicitly provided. As an Analyst, using the provided data, it's identified that symptom 491, location 204, and category 42 are the most frequently occurring attributes across incidents.

**Required Remediation:**
To improve incident management compliance for this control, it is required to regularly generate and formalize a report that aggregates these technical statistics. This report should clearly present the most affected symptoms (e.g., Symptom 491 as the most frequent), locations (e.g., Location 204, 143, 161 being most frequent), and categories (e.g., Category 42, 46, 26 being most frequent) to effectively deduce frequently targeted IT assets and infrastructures."
154,3,"The overall incident process compliance is critical, with all listed incidents showing fitness values between 0.19 and 0.5. Technical analysis identifies Symptom 491 (172 incidents), Locations 204 (111 incidents), 161 (104 incidents), and Categories 46 (68 incidents), 53 (44 incidents) as most frequently affected. A significant data gap exists with 65 incidents having no recorded symptom, hindering thorough technical analysis. Remediation requires enforcing mandatory symptom recording and further investigating the underlying causes for incidents concentrated in the identified locations and categories to improve compliance and deduce frequently targeted IT assets."
154,4,"The provided `technical_analysis` data is sufficient for the Analyst to report technical statistics related to occurring symptoms, affected categories, and locations. Analysis shows Symptom 491 (228 occurrences), Category 46 (104 occurrences), and Location 204 (171 occurrences) are the most frequent. This enables the deduction of frequently targeted IT assets and infrastructures, fulfilling the ""Report Technical Analysis and most affected categories"" control's objective. No remediation for insufficient data is required for generating this report."
